"lista","EJ.1.A","EJ.1.B","EJ.1.C","Total.E1","EJ.2.A","EJ.2.B","EJ.2.C","EJ.2D","EJ.2E","EJ.2F","Total.E2","Puntaje.total","HW3_grade","partner_number","answer_1_c","AI","favorable","HW_1","HW_2","HW_3","Midterm_25","Midterm_25.1","Exam_35","Final_grade","Final_grade_excluding_HW_3"
"76f2c28c1ed62d24b946af8ffbb3815cb63a2c817d3d86b74305d401b80b1eb9",10,5,10,25,10,6,"10",7,10,10,"53","78","6,2","382ee4a133feeaf4ac21fe84abdfd482911ffed7cac1b597e9b44321a896adb6","Basándonos en los resultados anteriores de las preguntas 1. A) y B) en relación a las diferencias promedio en las notas de corte y teniendo en cuenta que la nota de corte promedio es superior para los alumnos de amplia competencia, en comparación con los alumnos beneficiarios de una cuota. Esto implica que los alumnos de amplia competencia, generalmente, requieren puntajes mas altos para ser admitidos en los mismos cursos que los alumnos beneficiados. Por otra parte, la política de cuotas implementada en Brasil asegura que el 50% de los cupos de admisión en los cursos, están asegurados/reservados, para alumnos que provienen de escuelas públicas y dentro de este 50%, hay fracciones específicas para alumnos negros, mulatos, indígenas, etc. Es por este sistema, que podemos observar ciertas implicancias, que serán abordadas a continuación:

1. En relación al comportamiento elitista de los empleadores:
Si es que los estudiantes beneficiados de cuotas, demuestran que logran un buen desempeño, esto puede producir, que cambien los prejuicios y disminuya un poco el comportamiento elitista por parte de los empleadores, ya que, esto podría demostrar que las capacidades no dependen
únicamente del colegio al cual asistió el alumno y de esta manera se podrían empezar a valorar más los resultados académicos universitarios. Con este sistema de cuotas, como pueden ingresar mas alumnos beneficiados a las universidades, estas pueden presentar una mayor diversidad de alumnos, y gracias a esto generar enseñanzas distintas a cuando no estaba este sistema, es por esto, que se podría reducir el sesgo que realizan los empleadores en relación con los alumnos asistentes a colegios privados y más caros, debido a que se puede tomar más en cuenta las habilidades y capacidades adquiridas en la educación superior.

2. Efecto en la discriminación contra los negros y los pueblos indígenas en los procesos de contratación:
Como el sistema de cuotas le otorga más oportunidades de acceder a una educación superior de calidad, en el caso de los negros e indígenas, estos van a estar más nivelados con el resto de las personas a la hora de entrar al mercado laboral. Todo esto, debido a que pueden tener títulos de universidades más prestigiosas, que antes era más difícil de obtener, lo que puede hacer que haya menores barreras de discriminación en relación a este entorno. Al incluir aún más a los negros e indígenas en las universidades de calidad, pueden eventualmente producir una mayor inclusión de ellos en el mercado laboral, reduciendo la discriminación en relación a los empleos. Esto, debido a que al tener mayor contacto y visibilidad con ellos, se pueden ir reduciendo ciertos estereotipos. Además, con el sistema de cuotas se promueve la inclusión en la educación, por lo que, puede llevar a que también se promueva más en el mercado laboral y los empleadores valoren más la diversidad. Hay que tener en cuenta, que para ambas preguntas también podría suceder el caso contrario, en el caso del impacto en el comportamiento elitista de los empleadores, podría suceder, que aumente la tendencia de considerar los colegios en los procesos de contratación, debido a que como las cuotas aseguran que estudiantes de diversas procedencias tienen acceso a este nivel alto de universidades, recurren a los colegios como método de diferenciación para evaluar a los candidatos. En relación al impacto en la discriminación, si es que los empleadores continúan analizando el colegio de procedencia para la selección, las barreras de discriminación se podrían mantener, enfrentando desventajas en el mercado laboral y reduciendo las posibilidades de empleo.",0,0,6.6,6.7,6.2,3.6,5.8,5.6,5.3,74.81203008
"a56419221529acb5ca76ac855c30d6c99aee101f35ee439a2353292bd0f81f55",10,4,7,21,3,5,"10",10,10,10,"48","69","5,6","solo","Con las medidas del uso de cuotas en Brasil se podría reducir el elitismo de parte de los empleadores a la hora de contratar trabajadores. Esto se debe a que con esta idea hay más egresados negros y de pueblos indígenas de buenas universidades, de modo que estos tienen así, más oportunidades de ser considerados por los empleadores que con el sistema que hay en Chile. Mientras que, como se dice en el enunciado, Chile tiene múltiples empresas que se interesan por los colegios donde estudiaron los egresados, la medida implementada en Brasil puede mostrar que alumnos que no hayan salido de colegios de alto nivel socio-económico tienen capacidades iguales o superiores a los egresados de dichos colegios.",0,1,6,6.6,5.6,5.2,5.5,4.7,5.2,74.43609023
"58a4665c7a0685ef7c94d902e80d42cf07a46cebc6818ee670dd3e96574fbe96",10,10,10,30,7,7,"10",10,8,10,"52","82","6,5","e5cfc207b8eb9a5d7229fccb9156fc42ccdb6060a2048f4c553f33bd5ea7e08a","Ya que existe un valor-p igual a 0 podemos concluir que existe evidencia estadística significativa para afirmar que la nota de corte promedia es estadísticamente superior para los alumnos de amplia competencia.

De este modo podemos entender que para alumnos de amplia competencia es más difícil acceder a la educación superior frente a los que tienen cuotas reservadas ya que las notas de corte son más altas para ellos. 

Esta estrategia otorga una ventaja de acceso a educación superior para alumnos procedentes de escuelas públicas, alumnos negros y alumnos indígenas. Sin embargo, el comportamiento elitista de los empleadores de discriminar la empleabilidad considerando el colegio en el que estudiaron los postulantes a un trabajo podría representar una amenaza al propósito de la estrategia de cuotas reservadas, ya que el esfuerzo generado en facilitar el acceso a educación superior a estos segmentos de personas sería en vano. Los empleadores categorizarían la calidad del empleado por señales que dictan previas a su educación superior. Es decir, obtener el grado no representaría una señal de alta productividad, alta calificación u otro rasgo de calidad superior.",100,0,6.5,6.9,6.5,4.4,5.4,5,5.2,73.23308271
"88801206d6f33a55229e76eef908df2bafc609c1efff724956e8f56c24250947",10,10,7,27,5,6,"10",5,10,9,"45","72","5,8","1cbfbfa9a1fb7de03027bdcf67018fcf7490ab1a364e4032c73a1900783139ce","La implementación de políticas de cuotas en las universidades públicas brasileñas tiene el potencial de reducir el elitismo educativo y la discriminación en el mercado laboral. Al graduarse todos de la misma universidad pública, sin importar su origen socioeconómico o racial, se nivelan las señales educativas para los empleadores. Esto permite que personas de origen indígena o afrodescendientes, beneficiadas por las cuotas, compitan en igualdad de condiciones. Además, la diversidad de estudiantes con diferentes contextos educativos enfatiza la calidad de la educación superior como indicador principal de habilidad y preparación profesional, desafiando las preferencias tradicionales por escuelas privadas prestigiosas.",100,1,6.6,6.1,5.8,3.8,5.8,5.5,5.3,74.58646617
"293c17f626b180210da607591fce4edcdcd8e616641456d7bf78347ff033197a",10,5,4,19,3,5,"10",7,9,10,"44","63","5,2","solo","El sistema de cuotas (becas) en sí no genera un cambio en la discriminación pues el
empleador no ve si un individuo tuvo o no beca, lo que si puede generar un cambio es que el
sistema de becas se puede usar en instituciones públicas de alta calidad, el establecimiento si
representa una señal para el empleador y, por tanto, podría representar una baja en la
discriminación racial debido a que no se concentran en la etnia en sí.",NA,1,6.9,6.5,5.2,5.1,5.6,6.2,5.8,82.93233083
"30ddbeb3e1213cd7b2dc751255248e073efe90f741f536f729c848b3879d03b6",10,5,10,25,4,5,"10",7,10,10,"46","71","5,7","f883a56de3b04b7ed0f0e02ac21ef66c6331e9d1fb6ce3a6001ae4a881ee82ea","La política de cuotas en las universidades públicas de Brasil intenta ser justa y dar más oportunidades educativas a grupos que han sido marginados por mucho tiempo. Sin embargo, esta política puede tener efectos mixtos en cómo los empleadores ven a estos estudiantes y en la discriminación contra las personas negras e indígenas durante el proceso de contratación.

Los empleadores podrían pensar que los estudiantes que entraron por cuotas no tuvieron que cumplir con los mismos estándares académicos difíciles que los demás, lo que podría ser visto de manera negativa. Esto puede actuar como una señalización negativa, ya que los empleadores podrían asumir que estos candidatos no atravesaron los mismos estándares académicos que la competencia para poder ser admitidos. Este prejuicio podría llevar a la conclusión de que estos estudiantes son menos calificados, sin importar sus habilidades y desempeño real.

Si los empleadores creen que los estudiantes de cuotas recibieron ventajas en su educación superior, podrían discriminar contra ellos, incluso si son buenos candidatos con muchas calificaciones. El contratante, al presentarse una persona que pertenece a uno de estos grupos, podría generar una discriminación negativa, concluyendo que su educación fue facilitada y no por sus propios méritos. Esto estaría aumentando aún más la discriminación a estos grupos fuera de su origen étnico.

La preferencia por candidatos de escuelas privadas y prestigiosas podría crecer, ya que los empleadores podrían pensar que los estudiantes de cuotas recibieron una educación de menor calidad. Esto podría llevar a una mayor discriminación y actitudes elitistas en la contratación hacia estos grupos, a pesar del objetivo positivo de la política de promover la igualdad. Los empleadores podrían preferir candidatos provenientes de un entorno educativo con mayores oportunidades, personas que no tuvieron la necesidad de acceder a cuotas.",64,0,5.3,6.5,5.7,NA,6.4,4.7,5.3,75.33834586
"83b05a09a998f28a1be0da301957d548d678ea527788e0a7d7c55c0fc53d6b33",10,5,7,22,7,5,"7",10,10,10,"49","71","5,7","549a8ea6882cd07140323f880a72e54b0980087a3a83493cbba5e614f8607224","Primero, la política de cuotas en las universidades públicas brasileñas podría afectar positivamente este comportamiento elitista por parte de los empleadores en Brasil. Al implementar cuotas que promueven la inclusión de estudiantes de distintos orígenes, tanto socioeconómicos como étnicos en las universidades, se estaría fomentando la diversidad y la equidad en el acceso a la educación superior.

Esta medida podría contribuir a disminuir la discriminación contra grupos minoritarios, como negros e indígenas, en el proceso de contratación, ya que los empleadores tendrían acceso a una fuerza laboral más diversa y representativa. Al priorizar la calidad de la educación superior y la meritocracia en lugar del colegio de origen, se estaría promoviendo un ambiente laboral más inclusivo y justo para los candidatos.",100,1,6.5,6.8,5.7,4.9,6,5.3,5.5,78.87218045
"2d43b55cdc8eb5ef34146cabb59adaa3429a9db4318ede420121642a0ec6f2fa",10,5,7,22,10,6,"10",7,10,10,"53","75","6,0","09d2d967c4644d331042b71cdf3944cef57cbd543d344738d74af1724b4476f8","Las medidas de admisión en las universidades públicas de Brasil, con el objetivo de
aumentar la presencia de alumnos de comunidades marginadas como indígenas,
personas de escasos recursos y afrodescendientes, pueden ayudar a disminuir la
discriminación en el ámbito laboral. Al brindarles a estos estudiantes la posibilidad de
acceder a una educación de excelencia, se les está mostrando que son capaces de
lograr un rendimiento académico sobresaliente, lo que podría cuestionar y modificar
las percepciones discriminatorias vigentes.

Estas reglas de ingreso podrían ser clave para disminuir la discriminación en la
postulación para un trabajo. Si los empleadores se centraran más en los títulos
universitarios que en el origen socioeconómico o el tipo de escuela del candidato,
podrían reducir la discriminación por motivos socioeconómicos y étnicos. De esta
manera, las políticas de cupos no solo permiten el acceso a la educación superior para
estos grupos, sino que también pueden contribuir a la democratización del mercado
laboral en Brasil. Promoviendo un ambiente en el que se valore principalmente el
mérito académico, se puede ayudar de manera importante a crear una sociedad más
igualitaria y justa.",100,1,6.8,6.8,6,4.4,5.6,5.5,5.4,76.76691729
"33517ed44a89eadbed5c3ceb55de61979d5d45e0d2c3af57ae80210be0e40680",0,0,0,0,0,0,"0",0,0,0,"0","0","1,0","060683e08100716fb9a2c681306b95df4b60e6112f7eb7e1a54b652eccdfefaa","Dado que las notas de corte de los estudiantes afrodescendientes y de pueblos indígenas suelen ser más bajas en comparación con aquellos que ingresan por alta competencia, es probable que la política de cuotas aumente la discriminación hacia los egresados de escuelas públicas y socave la percepción de calidad de la educación superior al disminuir el mérito asociado con el ingreso a una universidad pública. Esta situación podría llevar a los empleadores brasileños a adoptar un comportamiento elitista similar al observado en Chile, aumentando la discriminación contra las personas de color e indígenas protegiéndose así de una posible distorsión en la señal educativa. Inicialmente, la política pública disminuye la brecha social y la desigualdad entre clases socioeconómicas, pero podría aumentar la discriminación laboral. Empeorando la posibilidad de ser contratado para grupos minoritarios.",51,0,6.3,6.8,1,4,4.6,5.9,4.9,73.23308271
"f400b5407ec562f3f0c94627224a59e04d3db574046d0304eb29e0b1f0746a5a",10,4,7,21,4,6,"10",10,10,10,"50","71","5,7","sola","Las políticas de cuotas en las universidades públicas brasileñas podrían ayudar en lo siguiente:

- La política permite que exista un número mayor de estudiantes de diferentes condiciones socioeconómicas y de diferentes etnias en las universidades públicas de alta calidad. Al haber un número mayor de estudiantes negros e indígenas en universidades públicas de calidad, aumenta el acceso de estos grupos a educación superior de mejor calidad, lo que mejora sus oportunidades de empleo.

- Esta política reduce los prejuicios negativos que algunos empleadores podrían tener. Al ver a personas de estas procedencias en el mercado laboral disminuirán los prejuicios y aumentarán las prácticas inclusivas.

- Se genera un cambio cultural dentro de las empresas, lo que aumenta la inclusión y disminuye la discriminación hacia personas de otras etnias o de otras procedencias económicas.",100,1,6.3,6.9,5.7,4,5.8,6,5.5,78.34586466
"9b2650a5063395e2b0b78fa04e90673f0918954d5071e3c73b69767b5d3f988f",10,10,7,27,4,7,"9",5,10,9,"44","71","5,7","sola","La política de cuotas se implementa para facilitar el acceso a la educación superior a estudiantes de grupos que han sido históricamente subrepresentados, como aquellos provenientes de escuelas públicas y comunidades afrodescendientes e indígenas. Esta medida busca nivelar las oportunidades, permitiendo que estudiantes que podrían ser excluidos en un sistema basado únicamente en notas de corte tengan acceso a la educación superior. 

Al permitir que una variedad más diversa de estudiantes acceda a una educación de calidad, las universidades públicas ayudan a crear una fuerza laboral más heterogénea. Esto puede llevar a los empleadores a valorar habilidades y competencias que van más allá del rendimiento académico tradicional. 

Además, esta política puede cambiar la percepción del prestigio académico. A medida que los graduados de distintos orígenes académicos se integran al mercado laboral y demuestran sus capacidades, la idea de que solo los estudiantes de colegios prestigiosos pueden tener éxito se debilita. Así, los empleadores podrían depender menos del historial académico como el principal criterio de selección. ",100,1,6.7,6.7,5.7,2.7,4.8,4.7,4.5,63.0075188
"6fcb9aa52e3614fa7a1989f230f589342fea4b77953406ea6f875df37f039613",10,5,7,22,10,9,"10",7,10,10,"56","78","6,2","b8bc29b27d9b5f85e7a4c28e36f55cdd94e02ac03578bce191461d2523678f4b","Antes de la política de cuotas la educación universitaria pública de alta calidad se consideraba algo privilegiado y al alcance de solo aquellos alumnos que habían tenido una educación privada, lo que contribuía a mantener una percepción elitista de la educación superior. La política de cuotas permite que un gran número de alumnos de escuelas públicas y de minorías accedan a una educación superior de prestigio. Esto ayuda a que los entrevistadores tengan candidatos de muchos colegios diferentes pero con la misma educación universitaria aplicando al mismo puesto de trabajo. A medida que estos estudiantes, de diferentes contextos, se gradúan y entran al mercado laboral, los empleadores se encuentran con un grupo más diverso de candidatos bien calificados, lo que debería disminuir fuertemente la discriminación contra estos grupos en el proceso de contratación. Gracias a esta política ya no se puede contratar a alguien de un colegio privado y saber que su desempeño será mejor que un alumno de un colegio público ya que ambos pueden haber asistido a la misma universidad y por lo tanto, tuvieron la misma educación superior, la que los hace igual de calificados para este trabajo. Además, desde el punto de vista de los graduados pertenecientes a los grupos discriminados, esta política aumenta sus posibilidades de estudiar en mejores universidades públicas, lo que abre sus fronteras de empleos y da la oportunidad de que ellos participen en mercados laborales que antes estaban reservados para alumnos que habían tenido una educación escolar privada y universitaria buena. Esta forma también muestra como disminuirá la discriminación contra los negros y los pueblos indígenas en el proceso de contratación.",49,1,6.6,6.8,6.2,4.9,6.6,6.5,6.1,87.51879699
"904fe8eaca9084218bdf22fe2ed1262544e47e6606d5d8c6ef63718b19eb39b4",10,10,7,27,10,6,"10",10,10,10,"56","83","6,5","95497cf2f6643db9dc5e5de7015e04e77e047901833d297c5a5b90c4f85c001b","Primero, y tal como se explicaba en el enunciado de la pregunta, es importante notar que el sistema de admisión de Brasil, es extremadamente competitivo por naturaleza, por lo tanto, es un “mercado” en el que solamente serán aceptados los mejores actores, haciendo que el sistema sea más “recompensador” a aquellos que se esfuercen, de mayor manera, independiente de su procedencia. Además, se menciona que las mejores universidades son las públicas, y que son gratis, por lo tanto, se elimina directamente otra barrera de entrada para aquellos que no cuentan con los recursos, lo que implica, que sin observar los datos, ya se sabe que el sistema brasilero es más equitativo e inclusivo en términos de admisión. Ahora, basado en los resultados obtenidos del t-test de la pregunta anterior, hay una diferencia importante con respecto a las notas de corte entre los estudiantes, donde los estudiantes de las cuotas obtienen, en promedio, menores calificaciones que los otros. Lo anterior, implica que la política implementada parece estar funcionando, ya que, aquellos con cuotas tienen casi 50 puntos menos que los demás, pero aun así cuentan con acceso a las universidades. Por lo tanto, desde el punto de vista de los empleadores, si toman las universidades (y su calidad) como señal para el nivel del trabajador, está claro que esta política aumenta las posibilidades que aquellos desfavorecidos tienen de ser contratados. Pero también, puede darse el caso de que los entrevistadores se guíen, además, por las notas obtenidas, situación en la cual, tal como se pudo observar en el test, los alumnos de amplia competencia debieran (en promedio) tener mayores oportunidades de contratación. De lo anterior, podemos pensar que el comportamiento elitista de los entrevistadores presentaría disminuciones, aumentando la consideración de contratación de aquellos “discriminados”, permitiendo un acceso más equitativo a todos. ",34,1,6,6.7,6.5,5,5.7,4.5,5.2,73.45864662
"3ddbbcebd9cfbe1452b0e3571f931dc686f3065ec034500de855f65c3e3680a3",10,5,10,25,4,4,"7",7,10,10,"42","67","5,5","7c338feca54c5f4d11a1fd4979b4abf73d0e8043f9c9a92754a0182baf6ac16c","La inclusión de esta cuota para las personas negras, mulatas, indígenas y egresados de colegios pertenecientes al sistema público puede llegar a reforzar el comportamiento elitista por parte de los empleadores brasileños, porque antes si una persona del grupo anteriormente mencionado se presentaba con un titulo, el empleador sabía que es porque había obtenido un gran puntaje y destacaba por sobre el resto en cambio ahora, es más probable que la persona haya logrado entrar a aquella universidad, debido a que el sistema la favorecía más que por ser excepcional, por ello los empleadores pueden tener un mayor prejuicio y dudar acerca de las verdaderas capacidades de la persona, egresada donde supuestamente ingresan los mejores, sin ser el mejor, pudiendo tener un impacto negativo en el proceso de selección para las personas de los grupos mencionados en un inicio. ",0,0,6.5,6.4,5.5,4,5.6,4.6,5.2,70
"240284d28f82f006fdba1836665e78b8c6074f4058a97961b96958b18b1694e2",10,5,0,15,4,6,"4,5",7,10,10,"41,5","56,5","4,8","solo",NA,NA,NA,6.5,5.7,4.8,4,5.9,4.4,4.9,69.54887218
"a019cd4f9ce196756e0df5d2ee9e074996318196c9fdbdfeae1cfd0fda7eb45b",10,5,7,22,10,7,"0",0,0,0,"17","39","3,6","d8f8c0fa8161591f444fe6c11a9905b2b2e070ad7542c5a0273b37dea7ed34df","Al aumentar la representación de estudiantes de diversos orígenes
socioeconómicos y étnicos en instituciones de educación superior de alta calidad,
los empleadores podrían comenzar a valorar más la diversidad como un activo.
Esto podría llevar a una disminución de los prejuicios basados en el tipo de
escuela secundaria que los candidatos han asistido, centrando la atención en la
educación superior obtenida y en los méritos individuales. Además, la mayor
inclusión de negros e indígenas en universidades públicas prestigiosas podría
aumentar su visibilidad en el mercado laboral, ayudando a normalizar la diversidad
racial y étnica en el lugar de trabajo y reduciendo los estereotipos y prejuicios. En
conjunto, estas dinámicas podrían contribuir a un mercado laboral más inclusivo y
equitativo, donde las habilidades y méritos individuales son valorados por encima
del origen socioeconómico y racial.",100,1,6.7,6.7,3.6,5,4.9,4.8,5,72.55639098
"18ff10650d0b85fd7d069dab6cadefc6bb7026f1b8aca0072737612581d38c63",10,10,7,27,6,6,"10",5,10,3,"40","67","5,5","ddcc5579ec111f7d662ae8d5c264a19808b6e614de843edead312996640a376e","Basado en los resultados obtenidos, es posible que la política de cuotas en las universidades brasileñas tengan un impacto positivo en la reducción del comportamiento elitista por parte de los empleadores. Al garantizar que un mayor número de estudiantes de diversas etnias y procedencias socioeconómicas acceden a una educación superior de calidad, se espera que los empleadores vean un grupo más diverso de candidatos graduados de estas instituciones prestigiosas. Esto podría ayudar a disminuir la discriminación basada en la escuela de procedencia y aumentar la valoración de las competencias y habilidades durante la educación superior. Además, al permitir que más estudiantes negros e indígenas accedan a la educación superior, la política de cuotas puede ayudar a reducir la discriminación contra estos grupos en el proceso de contratación. Con mayor representación en las universidades públicas de alto nivel, estos grupos podrían enfrentar menos prejuicios y ser elevados más equitativamente por sus méritos académicos y profesionales.",100,1,6.6,6.4,5.5,3.6,4.4,5.8,5,70.37593985
