"lista","EJ.1.A","EJ.1.B","EJ.1.C","Total.E1","EJ.2.A","EJ.2.B","EJ.2.C","EJ.2D","EJ.2E","EJ.2F","Total.E2","Puntaje.total","HW3_grade","partner_number","answer_1_c","AI","favorable","HW_1","HW_2","HW_3","Midterm_25","Midterm_25.1","Exam_35","Final_grade","Final_grade_excluding_HW_3"
"efecee12317fb259b3a249ff6fc771e727b9d091ed855f1489619e681a0cc4ba",10,5,7,22,10,6,"7",7,10,10,"50","72","5,8","9bea74d9683df2a8bc1f3a8c02b51dd83633e76e29d2ecc253dd528ee6507f3c","En Chile, existe este problema de que los entrevistadores de trabajo le dan mucha más prioridad a los alumnos que tuvieron acceso a escuelas particulares que aquellos candidatos que estudiaron en escuelas de acceso público, dándoles una gran ventaja a estos primeros, cuando los estudios del colegio no debiesen ser una señal relevante para ser considerada por el entrevistador, y por encima de sus estudios de educación superior.

Como pudimos comprobar en los incisos a) y b), efectivamente en los distintos cursos existen diferencias promedio en las notas de corte entre alumnos de alta competencia v/s alumnos con cuotas (siendo la nota exigida más alta para estos primeros). Esta política de cuotas que se emplea en las universidades públicas brasileñas, tiene el potencial de desafiar y reducir el comportamiento elitista por parte de los empleadores (como sucede fuertemente en Chile), reduciendo así, la discriminación estructural contra negros e indígenas y procedentes de escuelas públicas. Esto permite dar oportunidades más equitativas de acceso a educación superior de calidad, para que así, empleadores tomen como señal la educación superior, y no enfocándose en el tipo de colegio al cual el candidato accedió, ni color de piel, ni cualquier otra característica que permite al empleador tomar un comportamiento elitista, permitiendo que los individuos puedan competir basándose en su talento y mérito, independientemente de su trasfondo socioeconómico o étnico.

Por lo mismo, esta política permite reducir la discriminación contra los negros y candidatos provenientes de pueblos indígenas en el proceso de contratación, con las cuotas, se reducen barreras que limitan su acceso a educación superior. Con esto, se contribuye a oportunidades más equitativas en el mercado laboral.",44,1,6.9,6.9,5.8,3.6,5.4,5.8,5.3,74.73684211
"19cb53e5e0c7e75b3d8ba1efe1ca353f1ec3a6e90595f6b2994c8db10438fd9a",10,10,10,30,0,1,"1",6,10,10,"28","58","4,9","48fb67c5ab391f8c9e91b40bc9fbe87fcd28f0b8867397e0864f0a8e4fc19e5e","Brasil, con el mecanismo de cuotas, puede ser un tipo de señalización para los empleadores. Al ver un alumno con esta condición puede que piense que al entrar a una carrera requiriendo un menor puntaje, este sea menos productivo o menos competitivo, reafirmando un comportamiento elitista y perjudicando a las personas negras y de pueblos indígenas al ser discriminados por cumplir esta condición de cuotas y ser vistos como menos capaces.",NA,0,5.6,6.8,4.9,3.8,4.9,5.7,5,72.03007519
"8ebad0f521107a481833561aa0b6d13ed81da6bb389dcdc77ee8c6f3255e9530",0,0,0,0,3,7,"10",6,10,8,"44","44","3,9","solo ",NA,NA,NA,6.2,5.8,3.9,5.5,6.2,4.7,5.4,77.7443609
"c34894873df49bfc5e4d53321fa21a514ea5023031be687ddc6492cccbf7b9c5",10,5,7,22,10,7,"8",7,10,10,"52","74","5,9","sola","La política de cuotas en las universidades públicas de Brasil tiene el potencial de reducir el elitismo de los empleadores y la discriminación contra negros e indígenas al diversificar el acceso a la educación superior. Al permitir que estudiantes de diversos orígenes socioeconómicos y étnicos accedan a universidades de prestigio, se fomenta que los empleadores valoren más la calidad educativa que la procedencia escolar, disminuyendo así el sesgo hacia alumnos de escuelas caras y prestigiosas. Esta mayor diversidad de graduados en el mercado laboral puede demostrar que los estudiantes de políticas de cuotas son igualmente competentes, lo que ayuda a cambiar percepciones y a reducir prejuicios. Aunque los resultados muestran que los estudiantes sin cuota tienen un promedio de notas de corte más alto, la presencia de estudiantes con cuota en universidades prestigiosas evidencia su capacidad académica y profesional. Esto promueve la igualdad de oportunidades y desafía el elitismo en el proceso de contratación, contribuyendo a un mercado laboral más justo e inclusivo. ",100,1,6.7,6.8,5.9,4.3,4,5.2,4.9,68.72180451
"c6b95ec3d151f08485558ce12e6a75663f3a18ff466a1312ade5c111183f4248",10,5,10,25,5,7,"10",10,10,10,"52","77","6,1","ff8ee59f3788e09ab27f35adfeee5db30a131346884d92a7f00d7b9b79eea965","Me da la impresión, que el colegio de origen es una forma de diferenciar entre los
candidatos en búsqueda de un valor agregado que este podría proporcionar, ya sea por el
“networking” o conexiones y contactos que se dan en estos colegios “prestigiosos”, por el carácter, la cultura o los valores en la formación que puedan ser de interés (ajenos a los del hogar), y/o derechamente por la preparación que estos proporcionan. Lamentablemente este “Valor agregado” no depende de la habilidad del candidato, y por más que este haya querido sumar complemento a su persona, esas cualidades dependen netamente de factores externos de su contexto socioeconómico. Cabe agregar que ese análisis fue tratando de abogar imparcialmente por las empresas, porque en realidad se da muchas veces que de frentón la gente es clasista o racista, y prefiere trabajar con gente similar a ellos mismos, y por eso se pregunta el colegio, para encontrar un punto en común. 

Dicho esto, desgraciadamente no creo que en primera instancia las cuotas ayuden puntualmente con problemas elitistas como este en Brasil, es más, podría provocar más diferenciación con el descontento para algunos de quedar afuera con mayor puntaje. Si bien, por ejemplo, si contribuye a problemas de falta de representación laboral de estas minorías, al hacer más abundante en cantidad su oferta laboral, el tema cultural no es tan simple. Tendría que pasar harto tiempo y varias generaciones de estudiantes y trabajadores de distintos contextos
conviviendo, estudiando y trabajando hasta que se cambien percepciones, prejuicios y tratos entre sí.

Este tipo de políticas tiene que ir acompañadas de un montón de trabajo adicional de índole social y cultural, de modo que eso no afecte el rendimiento de la política de un punto de vista educacional y laboral. Pero la política de las cuotas por si sola, más allá de crear más variedad en la oferta laboral de profesionales en general, no veo como podría mejorar el comportamiento elitista o la discriminación contra los negros y los pueblos indígenas en el proceso de contratación. Incluso podría generar más odio de parte de los clasistas, elitistas o racistas. Espero se logre implementar de manera adecuada para que si genere un cambio y Brasil obtenga un proceso de contratación más amigable para sus minorías.",0,0,6.3,6.4,6.1,4.2,5.7,5.7,5.4,76.76691729
"307e9116363012bc21917ab89192d2cc18fa13c1bec3c7f55dd925421d245054",10,5,10,25,10,6,"7",7,10,10,"50","75","6,0","46960667dceaff4517f5fed304a494c357d35ac2963c8f401d2a6f8dbabb103c","Si se implementa esta política de cuotas en las universidades públicas brasileras y basándonos en los resultados obtenidos, se puede inferir que este tipo de comportamiento elitista por parte de los empleadores en Brasil disminuiría. Esto debido a que al necesitar una nota promedio menor, se les dará la oportunidad de obtener una educación de calidad. 
La discriminación contra los negros y los pueblos indígenas tendería a disminuir. Esto ya que al lograr una educación superior podrán entrar en el mercado laboral y alcanzar puestos importantes de trabajo. 
Por el contrario, la implementación de esta política podría a su vez, aumentar la discriminación. Esto gracias a que los empleadores al tener las entrevistas de trabajo, si ve que esta persona pertenece a alguna de las cuotas, inmediatamente va a inferir que tiene menos mérito ya que puede haber tenido menos dificultades para entrar.",72,0,6.6,6.8,6,3.7,2.6,5.3,4.4,61.65413534
"3cb425ab57c315a849b03abd64873c6dc75bca31ed0639e8a0ca8b57c117c7c1",10,5,10,25,10,10,"10",10,10,10,"60","85","6,7","11be57637421087397a1bc0a2e2401bd8106ff05ad9b0e10438541098bdf0f9b","Creo que la política de cuotas en las universidades públicas brasileñas van a afectar negativamente al comportamiento elitista de los empleadores. Esto debido a que, como pudimos ver tanto en el histograma como en la prueba t, el promedio de las notas de corte de los alumnos de alta competencia es mayor que el promedio de las notas de corte de los alumnos con cuotas. Lo que permite pensar justificadamente, que aquellos alumnos que entraron a la universidad por medio de las políticas de cuotas por poseer determinadas características étnicas, físicas o socioeconómicas, necesitaron un menor rendimiento para aprobar el examen de admisión ""Vestibular"". Y todo ello, incrementará la discriminación a estos grupos específicos pues para adquirir su educación superior necesitaron de un menor puntaje que el resto de jóvenes de la misma generación; Una diferencia de rendimiento bastante significativa según los resultados interpretados en la prueba t de la pregunta b), una diferencia de rendimiento que puede hacer que se menosprecien sus capacidades, y, por lo tanto se subestime su rendimiento futuro en su respectivo empleo.",37,0,6.7,1,6.7,4,NA,5,4.7,65.93984962
"c8afe04403384102c289a2aa94b4cca63d81ad75fbb7eb19e88907d4ec3ad9c0",0,5,7,12,10,8,"10",7,10,9,"54","66","5,4","3ef13587d011366012a495e831fc9d338307e45237451fa1ee815bf19b31aa81","Nosotros creemos que esta medida disminuye considerablemente la discriminación hacia los negros y los pueblos indígenas ya que en las respuestas anteriores nos podemos dar cuenta que aquellas personas que no tienen cuotas, osea, no son negras ni de pueblos indígenas tienen un puntaje de corte promedio mayor a los que si tienen cuotas, por lo tanto, en las universidades aumentaran la cantidad de personas negras y de pueblos indígenas. Esto va a afectar el comportamiento elitista de los empleadores ya que con el pasar del tiempo va a haber evidencia empírica de que el rendimiento de los trabajadores no depende del colegio del que salieron, si no que depender más de la universidad en que estudiaron. Este hecho va a provocar que a medida que avance el tiempo va a ir disminuyendo cada vez más la discriminación los negros y de pueblos indígenas.",100,1,6.5,6.8,5.4,5.2,5.7,4.9,5.4,76.76691729
"5475086284a033aa46c13893ee830b7e4e6575c6ac0d8df89324c11ec25cad47",10,10,7,27,10,8,"10",10,10,10,"58","85","6,7","sola","Dado que la diferencia entre la notas de corte promedio es significativa, ósea la nota promedio de corte para los alumnos de amplia competencia es significativamente mayor, yo considero que la política de cuotas puede tener un impacto significativo para reducir el comportamiento elitista de los empleadores, ya que esta política de cuotas logra reducir la brecha educacional (al instaurar ptjs de corte ajustados a las posibles desventajas de acceso educacional que tienen ciertos grupos) con lo cual logra diversificar la población estudiantil, y en consecuencia, diversificar los profesionales bien capacitados (de universidades publicas), fomentando una mayor equidad e inclusión en el mercado laboral y desestimando los prejuicios y estereotipos elitistas que tienen los empleadores, al demostrar que las personas graduadas de colegio no elite, también son muy capaces. 
En relación a lo anterior, de la misma manera, creo que esta política ayudara a disminuir la discriminacion contra las personas de raza negra y/o pertenecientes a los pueblos indigenas, ya que esta contribuirá a que puedan acceder a estudiar en la universidad publica (disminuyendo la brecha educacional), logrando una mayor educación y capacitación (en comparación a si no hubieran tenido acceso a la universidad), por tanto acotando la discriminacion (educacional) en el mercado laboral. ",63,1,6.7,6.6,6.7,4.7,5.3,5,5.3,73.90977444
"09d2d967c4644d331042b71cdf3944cef57cbd543d344738d74af1724b4476f8",10,5,7,22,10,6,"10",7,10,10,"53","75","6,0","2d43b55cdc8eb5ef34146cabb59adaa3429a9db4318ede420121642a0ec6f2fa","Las medidas de admisión en las universidades públicas de Brasil, con el objetivo de
aumentar la presencia de alumnos de comunidades marginadas como indígenas,
personas de escasos recursos y afrodescendientes, pueden ayudar a disminuir la
discriminación en el ámbito laboral. Al brindarles a estos estudiantes la posibilidad de
acceder a una educación de excelencia, se les está mostrando que son capaces de
lograr un rendimiento académico sobresaliente, lo que podría cuestionar y modificar
las percepciones discriminatorias vigentes.

Estas reglas de ingreso podrían ser clave para disminuir la discriminación en la
postulación para un trabajo. Si los empleadores se centraran más en los títulos
universitarios que en el origen socioeconómico o el tipo de escuela del candidato,
podrían reducir la discriminación por motivos socioeconómicos y étnicos. De esta
manera, las políticas de cupos no solo permiten el acceso a la educación superior para
estos grupos, sino que también pueden contribuir a la democratización del mercado
laboral en Brasil. Promoviendo un ambiente en el que se valore principalmente el
mérito académico, se puede ayudar de manera importante a crear una sociedad más
igualitaria y justa.",100,1,6.7,6.8,6,4,4.5,5.3,5,70
"1078debd870cfbd18fb8705652d5934db43272683e7f567f0ba5fbb77cf58708",0,0,0,0,0,0,"0",0,0,0,"0","0","1,0","0cb0a891ca334d9e09c9f12c5d1fda4c657b693e5eb832f9deb7d93b649da340","Si bien la política de cuotas implementada en las universidades públicas brasileñas tiene el objetivo de promover la equidad y proporcionar más oportunidades educativas a grupos históricamente marginados. La política basada en cuotas implementada por Brasil tambien sí podria afectar negativamente la discriminacion contra los negros y Pueblos indigenas en el proceso de contratacion. En primer lugar esto puede actuar como una señalización negativa para los empleados ya que estos podrían asumir y sacar las conclusiones de que ellos no tuvieron que atravesar los mismos estándares académicos que los de amplia competencia para poder ser admitidos.Esto se traduce en una percepción negativa por parte de los empleadores generando perjuicios que su trabajo fue facilitado y no por sus propios méritos concluyendo que estos son menos calificados independientemente de sus habilidades y desempeño real. Por lo tanto al presentarse una persona que pertenezca a uno de estos dos grupos, el contratante inmediatamente generará una discriminacion negativa contra ellos ya que estos obtuvieron privilegio en la educación superior por medio de cuotas aunque este aun así sea un muy buen candidato con muchos estudios de por medio. Esto estaría aumentando aún más la discriminacion a estos grupos fuera de su origen etnico. También podemos ver que si Brasil al igual que Chile también tiene una preferencia por candidatos de colegios particulares con más prestigios fijándose en su procedencia educativa, esta política podría aumentar esta tendencia los empleadores podrían preferir candidatos provenientes de un entorno educativo con mayores oportunidades por lo tanto personas que no tengan la necesidad de acceder a cuotas. Por lo tanto esta política por más que tenga un fin positivo de promover la igualdad sin quererlo puede traer consecuencias negativas aumentando la discriminacion y los comportamientos elitistas en la contratación hacia estos grupos. ",0,0,6.6,6.7,1,4.1,6.4,5,5.1,75.78947368
"8f9da0d4c13cfecccf23779c9a0d13931c8152593c08562198e494859f14c9bc",10,5,10,25,4,8,"7",7,10,10,"46","71","5,7","78ef8d1c8909a6a73ba6e3741cc90286e73fc2c2aaae9ec73b54c8b6d0d16011","Dado que el sistema además de admitir a los alumnos por sus puntajes los elige por otras
características, ser o no negro, ser o no de pueblos indígenas, se puede generar un nivel de
discriminación debido a que como hay cierto porcentaje de alumnos que deben pertenecer a
estas características, dejan de elegir a ciertas personas que quizá obtuvieron mejores puntajes
pero que fueron rechazados debido a que los cupos los debía utilizar otro alumno precedente
del sistema de cotas. Por otro lado, esta política de cuotas es una medida diseñada para
promover la equidad y la diversidad en la educación superior. Al garantizar el acceso a
universidades de alta calidad para estudiantes de grupos desfavorecidos, esta política no solo
mejora sus oportunidades educativas y laborales, sino que también contribuye a reducir el
elitismo y la discriminación en el mercado laboral. La teoría de la señalización apoya la idea de
que, al mejorar la diversidad de estudiantes en universidades prestigiosas, se mejora la
percepción de capacidad y talento de una gama más amplia de individuos, beneficiando tanto
a los estudiantes como a la sociedad en general.",57,0,6.4,6.3,5.7,5.2,4.9,4.4,5,70.67669173
"204f44fdc485bd13136ad2e514790d999d3c1023c24d2d775a414f172400ddae",10,5,7,22,10,8,"10",10,10,10,"58","80","6,3","sola","La política de cuotas puede tener distintos impactos, donde algunos podrían ser:
- Si se garantiza que mas estudiantes de grupos mas minoritarios y bajos ingresos puedan acceder a educación superior, cuotas podrían ayudar a mitigar la discriminación contra esos grupos en el mercado laboral, así los empleadores tendrían mas posibilidades de contratar a personas de estos grupos ya que habría un mayor numero de graduados calificados.
- Presencia de cuotas, si es exitosa, puede actuar como señal para empleadores de que graduados en universidades publicas son capaces de hacer la labores.
- Aumentar el numero de estudiantes con menos recursos en universidades de mas prestigio puede elevar la competencia entre estudiantes, lo que podría llevar a un aumento de calidad de los graduados beneficiando a empleadores como al mercado laboral en conjunto.
- Respecto a la discriminación, al existir mas personas negras e indígenas en buenas posiciones académicas se normaliza la diversidad en el ámbito educativo y continuándolo hacia el lugar de trabajo, lo que puede impulsar a que otros grupos los usen como modelo a seguir para aspirar a metas profesionales y educativas mas altas.",100,1,6.4,6.5,6.3,4.6,5.8,6,5.7,80.37593985
"7c338feca54c5f4d11a1fd4979b4abf73d0e8043f9c9a92754a0182baf6ac16c",10,5,10,25,5,5,"7",7,10,10,"44","69","5,6","3ddbbcebd9cfbe1452b0e3571f931dc686f3065ec034500de855f65c3e3680a3","La inclusión de esta cuota para las personas negras, mulatas, indígenas y egresados de colegios pertenecientes al sistema público puede llegar a reforzar el comportamiento elitista por parte de los empleadores brasileños, porque antes si una persona del grupo anteriormente mencionado se presentaba con un titulo, el empleador sabía que es porque había obtenido un gran puntaje y destacaba por sobre el resto en cambio ahora, es más probable que la persona haya logrado entrar a aquella universidad, debido a que el sistema la favorecía más que por ser excepcional, por ello los empleadores pueden tener un mayor prejuicio y dudar acerca de las verdaderas capacidades de la persona, egresada donde supuestamente ingresan los mejores, sin ser el mejor, pudiendo tener un impacto negativo en el proceso de selección para las personas de los grupos mencionados en un inicio. ",0,0,6.4,6.3,5.6,4.3,4,5,4.7,67.06766917
"744e41f7d7e1f05bd29229a944ee598b94d593aec4c012e50bdeb63a1cd0b6b7",10,5,7,22,3,5,"2",6,10,10,"36","58","4,9","8128f212ee8d9dc28f1ba1bfc8cd43e6d3ddbbd52651ff516d93efbadc112374","La política de cuotas en las universidades públicas brasileñas puede tener un impacto significativo en cómo los empleadores evalúan a los candidatos y en la discriminación contra grupos marginados en el proceso de contratación. 

Primero, al priorizar el acceso a la educación superior para estudiantes de escuelas públicas y grupos étnicos como negros e indígenas, las cuotas desafían la tendencia actual donde se da preferencia a estudiantes de escuelas particulares prestigiosas en los procesos de contratación. Esto podría cambiar la percepción de los empleadores sobre la relevancia del colegio de origen como señal de capacidad y potencial del candidato.

Además, al enfocarse en los logros académicos y la formación universitaria obtenida a través de cuotas, se puede fomentar una evaluación más objetiva y basada en el mérito. Esto podría reducir la discriminación sistémica al proporcionar oportunidades equitativas para todos los graduados universitarios, independientemente de su trasfondo socioeconómico o étnico.

En términos prácticos, la implementación de cuotas puede promover un cambio cultural hacia un entorno laboral más inclusivo y justo. Al aumentar la diversidad en la educación superior y posteriormente en la fuerza laboral, las políticas de cuotas pueden contribuir a una mayor sensibilidad hacia la equidad y la diversidad en las decisiones de contratación.

En conclusión, las cuotas en las universidades públicas brasileñas tienen el potencial de desafiar el comportamiento elitista en las entrevistas de trabajo y de reducir la discriminación contra grupos históricamente marginados. Al priorizar la educación superior como criterio principal de evaluación, estas políticas pueden promover un mercado laboral más equitativo y meritocrático en Brasil.",100,1,6.9,6.1,4.9,3.4,4.3,5.1,4.6,65.56390977
"c7b859a34f55d01dc848b5cb0dbd8a94fd27f1b45c43f029703e8a76a0ab2942",10,10,7,27,8,5,"10",7,10,10,"50","77","6,1","57d28de894c6278639896f213ce90e51924ccd8d988c73fdcf7c3ce23fa4cab4","La política de cuotas en Brasil afectaría al comportamiento de los empleadores, ya que al entrar a las universidades, las personas de escuelas públicas, personas negras o personas de pueblos originarios tienen más oportunidades, por lo que también habrá más diversidad e inclusión en la educación superior y posteriormente en el mercado laboral. Asimismo, los empleadores verán que más personas de este tipo estarán estudiando carreras profesionales y por consecuencia reducirán los prejuicios, estereotipos y discriminación que la sociedad tiene hacia ellos.",100,1,6.9,6.9,6.1,4.3,6.5,5.8,5.7,81.5037594
"ffe9e367f728fb31e9d85be20220d30ce9197c389d311153f0f0966aba5a7a10",10,5,0,15,5,8,"10",8,10,8,"49","64","5,3","solo ",NA,NA,NA,6.3,5.5,5.3,5.3,5.3,5.5,5.4,77.66917293
"e5cfc207b8eb9a5d7229fccb9156fc42ccdb6060a2048f4c553f33bd5ea7e08a",10,10,10,30,7,7,"10",10,8,10,"52","82","6,5","58a4665c7a0685ef7c94d902e80d42cf07a46cebc6818ee670dd3e96574fbe96","Ya que existe un valor-p igual a 0 podemos concluir que existe evidencia estadística significativa para afirmar que la nota de corte promedia es estadísticamente superior para los alumnos de amplia competencia.

De este modo podemos entender que para alumnos de amplia competencia es más difícil acceder a la educación superior frente a los que tienen cuotas reservadas ya que las notas de corte son más altas para ellos. 

Esta estrategia otorga una ventaja de acceso a educación superior para alumnos procedentes de escuelas públicas, alumnos negros y alumnos indígenas. Sin embargo, el comportamiento elitista de los empleadores de discriminar la empleabilidad considerando el colegio en el que estudiaron los postulantes a un trabajo podría representar una amenaza al propósito de la estrategia de cuotas reservadas, ya que el esfuerzo generado en facilitar el acceso a educación superior a estos segmentos de personas sería en vano. Los empleadores categorizarían la calidad del empleado por señales que dictan previas a su educación superior. Es decir, obtener el grado no representaría una señal de alta productividad, alta calificación u otro rasgo de calidad superior.",100,0,7,6.9,6.5,3.2,4.6,4.9,4.7,65.56390977
"508fadea01f4ac612110608ca48769f3b6f1934a4756db6cbb860dc4e6738e01",10,10,7,27,4,5,"10",10,10,10,"49","76","6,1","bc2cfdc136873cf5ee3bcae9a380a3d65610205fd8603d0119a23a0c6f01826d","""Si Brasil implementa la política de cuotas, podría significar un gran cambio en la
contratación, ya que daría prioridad a los candidatos con una sólida formación educativa sobre aquellos con calificaciones avanzadas. Esto ayuda a nivelar el campo de juego para aquellos que tradicionalmente no han tenido acceso a educación de élite, permitiendo que el talento y la capacidad sean los verdaderos criterios de selección.

La inclusión de grupos desfavorecidos en las universidades y el mercado laboral puede desafiar y, en última instancia, reducir los estereotipos raciales y socioeconómicos. La diversidad en el lugar de trabajo muestra que la eficacia profesional no se ve influenciada por la raza o el nivel socioeconómico, por lo que la lucha contra la discriminación depende en gran medida de esto. 

Las cuotas no solo promueven la igualdad de oportunidades en la educación superior, sino que también pueden transformar los principios de equidad en el mercado laboral, dando como resultado prácticas de contratación más justas que prioricen el mérito sobre el lugar del fondo socioeconómico o racial de los candidatos.""	37	1",37,1,6.3,7,6.1,4.8,6,5.9,5.7,81.65413534
