"Unnamed..0","EJ.1.A","EJ.1.B","EJ.1.C","Total.E1","EJ.2.A","EJ.2.B","EJ.2.C","EJ.2D","EJ.2E","EJ.2F","Total.E2","Puntaje.total","HW3_grade","answer_1_c","AI","favorable","HW_1","HW_2","HW_3","Midterm_25","Midterm_25.1","Exam_35","Final_grade","Final_grade_excluding_HW_3","average_grade","had_pair","df_fe","numb_tokes","jaccard_similarity"
50,0,5,7,12,2,"5","10",6,10,10,"43","55","4,7","La política de cuotas en las universidades públicas brasileñas busca promover la igualdad de oportunidades y reducir las desigualdades socioeconómicas y raciales en la educación superior. Basado en los resultados previos, podemos evaluar cómo esta política puede afectar el comportamiento de los empleadores y la discriminación en el proceso de contratación en Brasil.

Impacto en el Comportamiento Elitista de los Empleadores Diversificación de la Fuerza Laboral Educada: Las cuotas permiten que más estudiantes de entornos desfavorecidos, incluidos negros, mulatos, indígenas y aquellos de escuelas públicas, accedan a universidades de alta calidad. Esto genera una fuerza laboral más diversa, desafiando los prejuicios elitistas de los empleadores. 

Reducción del Énfasis en el Origen Escolar: La política de cuotas disminuye la importancia del colegio de procedencia. Los empleadores pueden enfocarse más en la formación universitaria y las competencias profesionales.

Mayor Enfoque en el Mérito Académico y Profesional: Si los graduados de universidades públicas demuestran habilidades y conocimientos equivalentes o superiores a los de otras instituciones, los empleadores podrían priorizar el mérito académico y profesional sobre el origen socioeconómico. 

Impacto en la Discriminación contra Negros e Indígenas Aumento de Oportunidades para Grupos Marginados: Las cuotas ofrecen más oportunidades a estudiantes negros e indígenas para acceder a la educación superior. Esto expone a los empleadores a un grupo más diverso de candidatos calificados, reduciendo prejuicios y discriminación racial.

Cambio de Percepción Social: A medida que más negros e indígenas obtienen títulos de universidades prestigiosas, la percepción social de estos grupos mejora, disminuyendo la discriminación basada en estereotipos negativos y promoviendo una mayor inclusión en el trabajo. 

Fomentar Políticas de Diversidad en las Empresas: La presencia de graduados de diversos orígenes puede motivar a las empresas a adoptar políticas de diversidad e inclusión, beneficiando tanto a individuos como a la cultura organizacional e innovación.",100,1,6.8,6.9,4.7,5,3.8,4.6,4.7,67.59398496,67.59398496,1,"df1",338,2.5
5,10,3,10,23,4,"4","10",7,10,10,"45","68","5,5","Debido a la política de cuotas implementada el 2012, es más fácil que estudiantes de colegios públicos, indígenas y negros puedan estudiar en la universidad. Si relacionamos esto con el caso chileno, al momento de que los estudiantes busquen trabajo, se discriminará a los estudiantes de colegios públicos, indígenas y negros al momento de buscar trabajo. Una de las razones puede ser que al momento de entrar a la universidad, estas pidieron menos puntaje para ellos (aprox 130 pts menos), lo que, de alguna manera, facilitó su entrada. Por lo tanto, aunque las universidades hayan bajado la exigencia para sectores más vulnerables, al minuto de que ellos busquen trabajo, serán ""castigados"" pos haber tenido una menor exigencia al momento de entrar a la universidad. ",45,0,6.8,5.5,5.5,4.6,5.7,5.65,5.4,77.70676692,77.70676692,1,"df1",144,0
69,10,10,7,27,6,"6","10",7,10,10,"49","76","6,1","1. Igualdad de Oportunidades en la Educación Superior:
La implementación de cuotas asegura que estudiantes de diversas procedencias socioeconómicas y étnicas tengan acceso a las universidades públicas de alta calidad. Al permitir que más estudiantes negros, indígenas y de escuelas públicas ingresen a estas instituciones, las cuotas nivelan el campo de juego en términos de acceso a una educación superior de calidad. 
2. Cambio en la Percepción del Mérito:
Tradicionalmente, la calidad percibida de una universidad juega un papel crucial en el proceso de contratación. Con la implementación de cuotas, se garantiza que los graduados de estas instituciones representan una muestra más diversa de la población. Esto puede ayudar a cambiar la percepción de los empleadores sobre el mérito, destacando que el talento y la capacidad no están confinados a aquellos provenientes de antecedentes socioeconómicos privilegiados. 
3. Reducción del Elitismo en la Contratación:
La política de cuotas puede reducir el sesgo elitista de los empleadores al mostrar que los estudiantes de diversas procedencias pueden alcanzar altos niveles de logro académico en universidades prestigiosas. Al diversificar el cuerpo estudiantil de estas instituciones, los empleadores pueden empezar a valorar más la diversidad y las experiencias únicas que los graduados aportan, en lugar de enfocarse exclusivamente en su origen educativo. 
4. Impacto en la Discriminación Racial y Étnica:
Al aumentar la representación de estudiantes negros e indígenas en universidades públicas de alto prestigio, las cuotas pueden desafiar y potencialmente cambiar los prejuicios raciales y étnicos. Los empleadores, al ver más graduados exitosos de estos grupos en el mercado laboral, pueden comenzar a cuestionar sus propios prejuicios y estereotipos, reduciendo así la discriminación durante el proceso de contratación. 
Conclusión:
La política de cuotas en las universidades públicas brasileñas tiene el potencial de reducir el elitismo y la discriminación en el mercado laboral al promover una mayor igualdad de oportunidades educativas. Al proporcionar a los estudiantes de antecedentes diversos el acceso a una educación de alta calidad, estas políticas pueden ayudar a cambiar las percepciones de los empleadores y a fomentar un entorno de trabajo más inclusivo y equitativo. Esto, a su vez, puede disminuir la discriminación contra los negros y los pueblos indígenas, contribuyendo a una sociedad más justa. ",100,1,6.9,7,6.1,4.5,5.9,5.2,5.4,76.91729323,76.91729323,0,"df1",550,1
8,10,5,10,25,10,"6","9",10,10,10,"55","80","6,3","Este sistema afecta negativamente al comportamiento de la elasticidad de los trabajadores. Esto porque, como podemos ver en las preguntas a y b, el promedio de los alumnos de alta competencia es más alta que los con cuota. Esto puede tornarse como que los alumnos que entran por cuotas, necesitan un menor rendimiento para aprobar el examen y eso llevaría a la discriminación. Esta diferencia puede hacer que no se confíe en ellos al momento de contratación.",NA,0,6.7,5.4,6.3,3.9,4.4,4.55,4.6,64.2481203,64.2481203,1,"df1",84,0
221,10,10,7,27,10,"5","10",10,10,10,"55","82","6,5","La política de cuotas en las universidades públicas brasileñas tiene el potencial de transformar el comportamiento de preferencia socioeconómica y élite de los empleadores. Al proporcionar acceso a una educación superior de calidad a estudiantes de minorías y de bajos recursos (como lo son personas de origen indígena o afrodescendientes), se puede demostrar que la capacidad y el talento no están confinados a un grupo socioeconómico específico, nivelando las señales educativas para los empleadores. Con el tiempo, esto puede reducir la discriminación en el proceso de contratación y fomentar una cultura de equidad y diversidad en el lugar de trabajo, permitiendo que estudiantes sin importar sus origenes socioeconómicos compitan en igualdad de condiciones. Además, la diversidad de estudiantes con diferentes contextos educativos enfatiza la calidad de la educación superior como indicador principal de habilidad y preparación profesional, desafiando las preferencias tradicionales por escuelas privadas prestigiosas.",100,1,6.9,6.4,6.5,3.4,6.4,6.6,5.8,81.57894737,81.57894737,1,"df2",211,4.5
14,10,10,10,30,5,"9","10",10,10,10,"54","84","6,6","La política de cuotas en Brasil busca ampliar la participación de grupos históricamente excluidos, como afrodescendientes e indígenas, en la educación superior y el ámbito laboral. Esta iniciativa tiene como objetivo disminuir las brechas sociales existentes y promover una sociedad más justa. No obstante, su efectividad en la erradicación de conductas elitistas y discriminatorias en los procesos de contratación aún genera debate. 
La política de cuotas, al introducir mayor diversidad en el ámbito educativo y, por ende, en el mercado laboral, puede combatir el elitismo establecido en la falsa creencia de la superioridad de ciertos grupos por su origen o nivel educativo. Al facilitar el acceso a la educación superior a estudiantes de grupos marginados, las cuotas pueden desmantelar el elitismo académico, es decir, la diversidad en las universidades cuestiona las concepciones elitistas sobre la competencia y el mérito académico.Pueden también fomentar la inclusión, promoviendo una cultura de inclusión y respeto por la diversidad, valores que se pueden trasladar al ámbito laboral y por último, derribar estereotipos. 
La apertura de las universidades públicas a estudiantes de diversos orígenes y trayectorias educativas enriquece la formación de profesionales y, por ende, diversifica la fuerza laboral. Esta diversidad de perfiles motiva a las empresas a valorar habilidades y competencias más allá del historial académico tradicional, abriendo espacio a la innovación y al crecimiento.Si bien las políticas de cuotas pueden tener un impacto positivo en la reducción de la discriminación en el proceso de contratación, también existen potenciales repercusiones negativas que deben considerarse: 
•	Aspecto positivo: Equidad de oportunidades: Las cuotas pueden actuar como un mecanismo para nivelar el campo de juego, aumentando las oportunidades de empleo para grupos históricamente marginados y combatiendo la discriminación sistémica. 
•	Aspecto negativo: Percepción de desmérito: No obstante, existe el riesgo de que las personas beneficiadas por las cuotas sean percibidas como menos merecedoras de sus puestos, lo que podría generar discriminación durante el proceso de contratación. En este sentido, resulta crucial educar a los empleadores sobre el propósito y los beneficios de estas medidas. 
•	Impacto en las prácticas de contratación: Las empresas que valoran la diversidad e inclusión pueden adoptar prácticas de contratación más equitativas, reduciendo la discriminación y promoviendo una cultura de igualdad de oportunidades. 
",100,1,6.7,7,6.6,2.7,3.6,6.15,4.7,66.35338346,66.35338346,1,"df1",573,2
21,0,0,5,5,3,"5","10",2,10,10,"40","45","4,0","Se puede concluir que el hecho de haber sido admitido por “cuotas” no implica que su
rendimiento de sus promedios sea menor a los de “no cuota”. Al hacer la prueba de ttest,
podemos evidenciar que obtiene mejores promedios. Dicho esto, podría disminuir la
discriminación por parte de los elitistas, siempre y cuando tengan la información
necesaria. En sí, el proceso de contratación sería más eficiente al no contar con mala
información, además que la señalización se vería sin juicios de valores.",0,1,3.9,4.3,4,3,5.2,5.25,4.5,64.62406015,64.62406015,0,"df1",108,2
67,10,4,10,24,10,"4","10",10,10,10,"54","78","6,2","Aplicar una medida como esta, bajo mi punto de vista, puede afectar de manera negativa el comportamiento elitista, es decir, los empleadores van a priorizar aun mas trabajadores que hayan estudiado en colegio ricos/privados/prestigiosos, esto se debe a que estos últimos si o si van a tener un puntaje corte mayor que quienes tienen cuota en la universidad, por lo que esto va a ser visto como una señal de mejor desempeño laboral. De manera más simple, quienes no tienen cuota no solo estudiaron en un mejor colegio, también tuvieron que sacarse un mejor resultado en la prueba por lo que tienen una mejor señal de ser mejores trabajadores.

Respecto a la otra pregunta,  yo si creo que una política como esta va a aumentar la discriminación en el país, dado a que las personas de color e indígenas van a tener una mayor probabilidad de estudiar en una universidad (suponiendo que toda la población tiene el mismo nivel de inteligencia) por lo que las personas que no son parte de esto grupos se verán perjudicadas, es decir, tienen un efecto fijo negativo.",100,0,6.2,6.3,6.2,5.7,5.9,4.3,5.3,75.63909774,75.63909774,0,"df2",206,0
56,10,5,7,22,4,"5","10",10,10,10,"49","71","5,7","Contexto y Resultados Previos 
De acuerdo con los resultados obtenidos: 
•	La diferencia promedio en la nota de corte entre los alumnos de amplia competencia y los alumnos con cuotas es significativa. 
•	El histograma muestra que la mayoría de las diferencias están en el rango positivo, indicando que las notas de corte para los alumnos de amplia competencia tienden a ser más altas. 
•	La prueba t de muestras pareadas confirma que esta diferencia es estadísticamente significativa con un valor t de 37.733 y un p-value < 2.2e-16, lo que sugiere que la nota de corte promedio para los alumnos de amplia competencia es significativamente mayor que la de los alumnos con cuotas. 
Impacto en el Comportamiento Elitista de los Empleadores Diversificación del Perfil de Graduados 
● Diversidad en Universidades Prestigiosas: La implementación de cuotas permite que más estudiantes de escuelas públicas, negros, mulatos e indígenas accedan a universidades públicas de alta calidad. Esto diversifica el perfil de los graduados de estas instituciones prestigiosas. 
Reducción del Enfoque en la Procedencia Escolar 
•	  Cambio de Enfoque: Con una mayor diversidad de antecedentes en las universidades de prestigio, los empleadores pueden comenzar a enfocarse más en la calidad de la educación superior y las habilidades adquiridas, en lugar de la procedencia escolar. 
•	 Meritocracia Real: Esto contribuye a una visión más justa y meritocrática del mercado laboral, donde el desempeño y las habilidades se valoran más que el origen educativo. 
Impacto en la Discriminación Contra Negros e Indígenas Mejora de Oportunidades Educativas 
•	  Acceso a Educación de Calidad: Las cuotas aumentan el acceso a la educación superior para negros e indígenas, brindándoles mayores oportunidades de desarrollo profesional y académico. 
•	  Reducción de Desigualdades: Al graduarse de universidades prestigiosas, estos grupos históricamente subrepresentados tienen mejores oportunidades de competir en el mercado laboral. 
Aumento de Representación y Visibilidad 
•	●  Mayor Representación: Una mayor representación de negros e indígenas en universidades de alta calidad ayuda a reducir la discriminación en el proceso de contratación. La presencia de más graduados de estos grupos en el mercado laboral puede romper estereotipos y prejuicios existentes. 
•	Role Models: La visibilidad de individuos exitosos de estos grupos puede servir de inspiración y cambiar percepciones negativas. 
Consecuencias a Largo Plazo
Persistencia de la Brecha Salarial de Género y Racial 
● Igualdad de Oportunidades: La política de cuotas puede contribuir a la igualdad de oportunidades y a la reducción de la brecha salarial de género y racial. Con más individuos de diversos antecedentes académicos y sociales en el mercado laboral, las empresas pueden valorar más la diversidad y la inclusión. 
Cambio en la Cultura Organizacional 
•	Políticas Inclusivas: Las empresas pueden adoptar políticas más inclusivas y valorar la diversidad como un activo, promoviendo ambientes laborales más equitativos. 
•	Evaluaciones Justas: Los procesos de contratación pueden evolucionar para centrarse más en las competencias y menos en los antecedentes socioeconómicos, promoviendo una cultura organizacional más justa y equitativa. 
Conclusión 
La política de cuotas en las universidades públicas brasileñas tiene el potencial de transformar el comportamiento elitista de los empleadores y reducir la discriminación contra negros e indígenas en el proceso de contratación. Al diversificar el perfil de los graduados y demostrar que el mérito y la capacidad no están restringidos a ciertos grupos socioeconómicos o raciales, se promueve una evaluación más justa y basada en competencias reales. Esto puede llevar a un mercado laboral más inclusivo y equitativo, donde las oportunidades no estén limitadas por el origen educativo o racial.",100,1,4,6.1,5.7,2.8,4,5.3,4.3,61.05263158,61.05263158,0,"df1",888,1.5
53,10,10,7,27,10,"6","10",10,10,10,"56","83","6,5","Primero, y tal como se explicaba en el enunciado de la pregunta, es importante notar que el sistema de admisión de Brasil, es extremadamente competitivo por naturaleza, por lo tanto, es un “mercado” en el que solamente serán aceptados los mejores actores, haciendo que el sistema sea más “recompensador” a aquellos que se esfuercen, de mayor manera, independiente de su procedencia. Además, se menciona que las mejores universidades son las públicas, y que son gratis, por lo tanto, se elimina directamente otra barrera de entrada para aquellos que no cuentan con los recursos, lo que implica, que sin observar los datos, ya se sabe que el sistema brasilero es más equitativo e inclusivo en términos de admisión. Ahora, basado en los resultados obtenidos del t-test de la pregunta anterior, hay una diferencia importante con respecto a las notas de corte entre los estudiantes, donde los estudiantes de las cuotas obtienen, en promedio, menores calificaciones que los otros. Lo anterior, implica que la política implementada parece estar funcionando, ya que, aquellos con cuotas tienen casi 50 puntos menos que los demás, pero aun así cuentan con acceso a las universidades. Por lo tanto, desde el punto de vista de los empleadores, si toman las universidades (y su calidad) como señal para el nivel del trabajador, está claro que esta política aumenta las posibilidades que aquellos desfavorecidos tienen de ser contratados. Pero también, puede darse el caso de que los entrevistadores se guíen, además, por las notas obtenidas, situación en la cual, tal como se pudo observar en el test, los alumnos de amplia competencia debieran (en promedio) tener mayores oportunidades de contratación. De lo anterior, podemos pensar que el comportamiento elitista de los entrevistadores presentaría disminuciones, aumentando la consideración de contratación de aquellos “discriminados”, permitiendo un acceso más equitativo a todos. ",34,1,6,6.7,6.5,5,5.7,4.5,5.2,73.45864662,73.45864662,1,"df2",434,0
301,10,10,7,27,8,"5","10",7,10,10,"50","77","6,1","La política de cuotas en Brasil afectaría al comportamiento de los empleadores, ya que al entrar a las universidades, las personas de escuelas públicas, personas negras o personas de pueblos originarios tienen más oportunidades, por lo que también habrá más diversidad e inclusión en la educación superior y posteriormente en el mercado laboral. Asimismo, los empleadores verán que más personas de este tipo estarán estudiando carreras profesionales y por consecuencia reducirán los prejuicios, estereotipos y discriminación que la sociedad tiene hacia ellos.",100,1,6.9,6.9,6.1,4.3,6.5,5.8,5.7,81.5037594,81.5037594,1,"df2",90,2
52,0,5,7,12,10,"8","10",7,10,9,"54","66","5,4","Nosotros creemos que esta medida disminuye considerablemente la discriminación hacia los negros y los pueblos indígenas ya que en las respuestas anteriores nos podemos dar cuenta que aquellas personas que no tienen cuotas, osea, no son negras ni de pueblos indígenas tienen un puntaje de corte promedio mayor a los que si tienen cuotas, por lo tanto, en las universidades aumentaran la cantidad de personas negras y de pueblos indígenas. Esto va a afectar el comportamiento elitista de los empleadores ya que con el pasar del tiempo va a haber evidencia empírica de que el rendimiento de los trabajadores no depende del colegio del que salieron, si no que depender más de la universidad en que estudiaron. Este hecho va a provocar que a medida que avance el tiempo va a ir disminuyendo cada vez más la discriminación los negros y de pueblos indígenas.",100,1,6.2,6.8,5.4,3.6,5.3,4.7,4.8,67.96992481,67.96992481,1,"df2",152,1.5
54,10,7,7,24,3,"4","10",10,10,10,"47","71","5,7","Basándome en los resultados obtenidos anteriormente, la política de cuotas en las universidades
públicas de Brasil tiene implicaciones significativas en el mercado laboral y en la discriminación.
Esta política podría reducir el elitismo en la contratación porque estudiantes de grupos desfavorecidos
tendrían más acceso a universidades de alta calidad. Esto puede equilibrar las oportunidades y hacer que
los empleadores consideren más la calidad de la educación superior que el origen socioeconómico del
empleado.
La inclusión de estudiantes negros e indígenas en universidades públicas prestigiosas disminuye la
discriminación en el proceso de contratación. Los empleadores tendrían que basar sus decisiones más en
las habilidades y logros académicos que en el origen étnico o social de los candidatos.
Además, a largo plazo, la política de cuotas puede promover una mayor diversidad en el lugar de trabajo,
lo cual es beneficioso tanto para la equidad social como para la innovación y la productividad dentro de
las empresas.",68,1,6.7,7,5.7,4.4,5.4,4.75,5.1,72.14285714,72.14285714,0,"df1",175,6.5
91,10,10,7,27,10,"8","10",10,10,10,"58","85","6,7","Dado que la diferencia entre la notas de corte promedio es significativa, ósea la nota promedio de corte para los alumnos de amplia competencia es significativamente mayor, yo considero que la política de cuotas puede tener un impacto significativo para reducir el comportamiento elitista de los empleadores, ya que esta política de cuotas logra reducir la brecha educacional (al instaurar ptjs de corte ajustados a las posibles desventajas de acceso educacional que tienen ciertos grupos) con lo cual logra diversificar la población estudiantil, y en consecuencia, diversificar los profesionales bien capacitados (de universidades publicas), fomentando una mayor equidad e inclusión en el mercado laboral y desestimando los prejuicios y estereotipos elitistas que tienen los empleadores, al demostrar que las personas graduadas de colegio no elite, también son muy capaces. 
En relación a lo anterior, de la misma manera, creo que esta política ayudara a disminuir la discriminacion contra las personas de raza negra y/o pertenecientes a los pueblos indigenas, ya que esta contribuirá a que puedan acceder a estudiar en la universidad publica (disminuyendo la brecha educacional), logrando una mayor educación y capacitación (en comparación a si no hubieran tenido acceso a la universidad), por tanto acotando la discriminacion (educacional) en el mercado laboral. ",63,1,6.7,6.6,6.7,4.7,5.3,5,5.3,73.90977444,73.90977444,0,"df2",267,1.5
13,10,5,7,22,8,"4","2",10,10,10,"44","66","5,4","La discriminación en el proceso de contratación contra los grupos mencionados, podría verse afectada y disminuida gracias a las políticas de cuotas, pues su objetivo es aumentar la representación y presencia de estos grupos en las universidades, y demostrar que los grupos mencionados pueden desempeñarse en áreas de alto redimiendo académico. Lo anterior podría reducir la discriminación en el proceso de contratación, pues dejarían de ser relevantes sus orígenes, y podría competir de igual a igual con personas que tal vez tuvieran un mucho mejor y más fácil camino ""inicial"" en la vida.",0,1,6.8,6.2,5.4,2.8,3.3,5.6,4.4,62.18045113,62.18045113,0,"df1",102,3
26,10,5,7,22,10,"6","10",5,10,10,"51","73","5,9","Posibles impactos de la Política de Cuotas en el Comportamiento Elitista:
1. La política de cuotas puede ayudar a diversificar el alumnado en las universidades públicas brasileñas, que son altamente competitivas y de mayor calidad, al garantizar que los alumnos de minorías y de bajos recursos tengan acceso a estas instituciones de prestigio, se incrementa la representación de estos grupos en el ámbito laboral.
2. Los empleadores, al observar un aumento en la cantidad de graduados provenientes de estas universidades públicas, podrían comenzar a valorar más la calidad de la educación superior que lo
s candidatos han recibido, en lugar de enfocarse únicamente en el tipo de escuela secundaria de d
onde provienen, todo esto llevaría a finalmente un cambio en los criterios de selección, quitándole protagonismo al criterio de educación secundaria.
Todo esto obviamente ayudaría mucho a reducir la discriminación, no solo de los negros y de los
indígenas, sino que la discriminación en el proceso de elección en general.",60,1,6.4,6.7,5.9,4.6,4.6,4.25,4.7,66.80451128,66.80451128,1,"df1",183,5
