"Unnamed..0","EJ.1.A","EJ.1.B","EJ.1.C","Total.E1","EJ.2.A","EJ.2.B","EJ.2.C","EJ.2D","EJ.2E","EJ.2F","Total.E2","Puntaje.total","HW3_grade","answer_1_c","AI","favorable","HW_1","HW_2","HW_3","Midterm_25","Midterm_25.1","Exam_35","Final_grade","Final_grade_excluding_HW_3","average_grade","had_pair","df_fe","numb_tokes","jaccard_similarity"
44,10,5,7,22,10,"7","8",7,10,10,"52","74","5,9","La política de cuotas en las universidades públicas de Brasil tiene el potencial de reducir el elitismo de los empleadores y la discriminación contra negros e indígenas al diversificar el acceso a la educación superior. Al permitir que estudiantes de diversos orígenes socioeconómicos y étnicos accedan a universidades de prestigio, se fomenta que los empleadores valoren más la calidad educativa que la procedencia escolar, disminuyendo así el sesgo hacia alumnos de escuelas caras y prestigiosas. Esta mayor diversidad de graduados en el mercado laboral puede demostrar que los estudiantes de políticas de cuotas son igualmente competentes, lo que ayuda a cambiar percepciones y a reducir prejuicios. Aunque los resultados muestran que los estudiantes sin cuota tienen un promedio de notas de corte más alto, la presencia de estudiantes con cuota en universidades prestigiosas evidencia su capacidad académica y profesional. Esto promueve la igualdad de oportunidades y desafía el elitismo en el proceso de contratación, contribuyendo a un mercado laboral más justo e inclusivo. ",100,1,6.7,6.8,5.9,4.3,4,5.2,4.9,68.72180451,68.72180451,0,"df2",220,3.5
45,10,5,7,22,10,"8","10",10,10,10,"58","80","6,3","La política de cuotas puede tener distintos impactos, donde algunos podrían ser:
- Si se garantiza que mas estudiantes de grupos mas minoritarios y bajos ingresos puedan acceder a educación superior, cuotas podrían ayudar a mitigar la discriminación contra esos grupos en el mercado laboral, así los empleadores tendrían mas posibilidades de contratar a personas de estos grupos ya que habría un mayor numero de graduados calificados.
- Presencia de cuotas, si es exitosa, puede actuar como señal para empleadores de que graduados en universidades publicas son capaces de hacer la labores.
- Aumentar el numero de estudiantes con menos recursos en universidades de mas prestigio puede elevar la competencia entre estudiantes, lo que podría llevar a un aumento de calidad de los graduados beneficiando a empleadores como al mercado laboral en conjunto.
- Respecto a la discriminación, al existir mas personas negras e indígenas en buenas posiciones académicas se normaliza la diversidad en el ámbito educativo y continuándolo hacia el lugar de trabajo, lo que puede impulsar a que otros grupos los usen como modelo a seguir para aspirar a metas profesionales y educativas mas altas.",100,1,6.4,6.5,6.3,4.6,5.8,6,5.7,80.37593985,80.37593985,0,"df2",204,1.5
571,10,5,7,22,10,"6","10",7,10,10,"53","75","6,0","Las medidas de admisión en las universidades públicas de Brasil, con el objetivo de
aumentar la presencia de alumnos de comunidades marginadas como indígenas,
personas de escasos recursos y afrodescendientes, pueden ayudar a disminuir la
discriminación en el ámbito laboral. Al brindarles a estos estudiantes la posibilidad de
acceder a una educación de excelencia, se les está mostrando que son capaces de
lograr un rendimiento académico sobresaliente, lo que podría cuestionar y modificar
las percepciones discriminatorias vigentes.

Estas reglas de ingreso podrían ser clave para disminuir la discriminación en la
postulación para un trabajo. Si los empleadores se centraran más en los títulos
universitarios que en el origen socioeconómico o el tipo de escuela del candidato,
podrían reducir la discriminación por motivos socioeconómicos y étnicos. De esta
manera, las políticas de cupos no solo permiten el acceso a la educación superior para
estos grupos, sino que también pueden contribuir a la democratización del mercado
laboral en Brasil. Promoviendo un ambiente en el que se valore principalmente el
mérito académico, se puede ayudar de manera importante a crear una sociedad más
igualitaria y justa.",100,1,6.7,6.8,6,4,4.5,5.3,5,70,70,1,"df2",214,3
59,10,5,7,22,5,"8","10",10,10,10,"53","75","6,0","Las políticas de cuotas incrementan el acceso de estudiantes talentosos de entornos pobres a universidades de alta calidad. Esto permite que más estudiantes de diversas procedencias ingresen a universidades prestigiosas, disminuyendo así la relevancia del colegio de procedencia como una señal de calidad. Los diplomas de universidades prestigiosas se convierten en una señal más creíble de la calidad del candidato, independientemente de su colegio de origen. Estoprovoca una cambio en la perspectiva que tienen los empleadores sobre la relevancia del colegio, ahoracomienzan a valorar más la calidad de la educación superior que el colegio de procedencia, ayudando a reducir los sesgos y las prácticas elitistas que discriminan a la gente mas pobre. El éxito académico y profesional de los estudiantes beneficiados por cuotas demuestra que el colegio de origen no es un buen indicador de habilidad, eliminando los prejuicios existentes de los empleadores elitistas como los de Chile. Tambien, las políticas de cuotas empoderan a los grupos marginados, permitiendo que más negros, mulatos e indígenas accedan a oportunidadesde educacion y trabajo de alta calidad. La visibilidad y el éxito de estos estudiantes en el mercado laboral ayudan a desafiar estereotipos y prejuicios, promoviendo una cultura más inclusiva.",100,1,5.5,6.9,6,4.5,4.6,4.35,4.7,66.42857143,66.42857143,1,"df1",213,4
55,5,5,7,17,3,"3","8",7,10,10,"41","58","4,9","La implementación de la política de cuotas en las universidades públicas
brasileñas tiene varias implicaciones para el comportamiento de los empleadores y
la discriminación en el proceso de contratación. Basándonos en los resultados
obtenidos en los incisos a) y b), podemos observar que las notas de corte para los alumnos con cuotas son generalmente inferiores a las de los alumnos de amplia
competencia. Esta diferencia es estadísticamente significativa, como lo demuestra
la prueba t de muestras pareadas.

La política de cuotas permite que un mayor número de estudiantes de contextos
socioeconómicos desfavorecidos, incluidos negros, mulatos e indígenas, accedan
a universidades públicas de alta calidad. Este acceso puede ayudar a reducir el
elitismo en las decisiones de contratación, ya que más estudiantes de escuelas
públicas tendrán la oportunidad de obtener títulos de instituciones prestigiosas.
Con una mayor diversidad en las universidades, los empleadores pueden
comenzar a valorar más la calidad de la educación superior recibida que el colegio
de origen del candidato, promoviendo una percepción más meritocrática basada
en el rendimiento académico universitario.

Además, al permitir que más estudiantes negros e indígenas accedan a
universidades de prestigio, la política de cuotas puede contribuir a reducir la
discriminación en el mercado laboral. Estos grupos podrán demostrar su
capacidad y competencia al tener títulos de instituciones reconocidas, lo que
puede cambiar las percepciones sociales sobre su talento. En consecuencia, la
discriminación en el proceso de contratación podría disminuir, mejorando la
inclusión y la equidad en el mercado laboral brasileño.

En conclusión, la política de cuotas en las universidades públicas brasileñas tiene
el potencial de disminuir el comportamiento elitista de los empleadores y reducir la
discriminación contra negros e indígenas en el proceso de contratación. Al
diversificar el perfil de los graduados y promover una percepción más justa y
basada en el mérito, esta política puede contribuir significativamente a la igualdad
de oportunidades en el mercado laboral.",100,1,5.6,6.5,4.9,3.8,4.8,5.9,5.1,72.48120301,72.48120301,1,"df1",371,4.5
421,10,5,7,22,10,"9","10",7,10,10,"56","78","6,2","Antes de la política de cuotas la educación universitaria pública de alta calidad se consideraba algo privilegiado y al alcance de solo aquellos alumnos que habían tenido una educación privada, lo que contribuía a mantener una percepción elitista de la educación superior. La política de cuotas permite que un gran número de alumnos de escuelas públicas y de minorías accedan a una educación superior de prestigio. Esto ayuda a que los entrevistadores tengan candidatos de muchos colegios diferentes pero con la misma educación universitaria aplicando al mismo puesto de trabajo. A medida que estos estudiantes, de diferentes contextos, se gradúan y entran al mercado laboral, los empleadores se encuentran con un grupo más diverso de candidatos bien calificados, lo que debería disminuir fuertemente la discriminación contra estos grupos en el proceso de contratación. Gracias a esta política ya no se puede contratar a alguien de un colegio privado y saber que su desempeño será mejor que un alumno de un colegio público ya que ambos pueden haber asistido a la misma universidad y por lo tanto, tuvieron la misma educación superior, la que los hace igual de calificados para este trabajo. Además, desde el punto de vista de los graduados pertenecientes a los grupos discriminados, esta política aumenta sus posibilidades de estudiar en mejores universidades públicas, lo que abre sus fronteras de empleos y da la oportunidad de que ellos participen en mercados laborales que antes estaban reservados para alumnos que habían tenido una educación escolar privada y universitaria buena. Esta forma también muestra como disminuirá la discriminación contra los negros y los pueblos indígenas en el proceso de contratación.",49,1,6.6,6.8,6.2,4.9,6.6,6.5,6.1,87.51879699,87.51879699,1,"df2",287,3
16,10,10,10,30,10,"5","8",7,10,10,"50","80","6,3","Esta cuota de equidad que se aplica en Brasil puede dar incentivos a que las empresas se fijen no únicamente en su educación superior. Esto dado que se sabe que hay gente “más capaz” (medido en que obtuvo mejores puntajes), que quedó fuera de la selección por no entrar en los cupos de equidad o viceversa, gente que obtuvo menores puntajes y entró de todas formas a una universidad más prestigiosa.
Esta falta de discriminación genera que las empresas no se puedan asegurar los trabajadores de mejor calidad en base a la señalización que entrega la institución de educación superior de los postulantes, generando que otros aspectos se vuelvan una señalización relevante a la hora de conseguir trabajo.
Esta señalización poco clara, podría generar una discriminación para quienes estudiaron en universidades prestigiosas, pero son elegibles por esta cuota de equidad (negros, indígenas, otros). Esto se debe a que, a pesar de haber estudiado en una buena universidad, los empleadores pueden desconfiar de la señal y creer que tienen un menor rendimiento que quienes estudiaron en esa universidad y no tenían la opción de haber entrado por esta vía de equidad que les exigía menos puntaje.
Esto puede agravar la discriminación que exista por los negros e indígenas en el mercado laboral, ya que, las empresas preferirán evitar contratarlos para asegurarse de que no hayan entrado por cotas de equidad y sí hayan obtenido un buen rendimiento en la prueba estandarizada (señalización de trabajador bueno).",52,0,6.5,6.4,6.3,4,4.5,5.3,4.9,69.54887218,69.54887218,1,"df1",276,0.5
66,10,5,7,22,10,"5","10",7,10,10,"52","74","5,9","La política implementada busca que jóvenes provenientes de colegios públicos, negros y/o de pueblos indígenas tengan acceso a mejores oportunidades. Es por esto, que al facilitar su acceso a Universidades prestigiosas mejoran sus señales, ya que es posible que sin la política entren a peores Universidades, o que ni siquiera entren. De esta manera, la política implementada es una forma de ""igualar la cancha"" entre los jóvenes. Por lo tanto, cuando los jóvenes egresen de la Universidad, es más probable que las firmas se enfoquen en el título Universitario, que el colegio de egreso. Respecto a la discriminación contra los negros y los pueblos indígenas, en el ámbito laboral debería disminuir, ya que al salir de buenas Universidades envían una señal a las firmas de ser buenos, por lo que estas tendrían incentivos a contratarlos para de esta manera maximizar las ganancias de la empresa.",65,1,7,7,5.9,5.4,6.2,6.25,6.1,87.03007519,87.03007519,1,"df1",165,3.5
6,10,5,7,22,10,"7","10",10,10,10,"57","79","6,3","Con lo mencionado y visto anteriormente, la implementación de políticas de cuotas
en las universidades públicas brasileñas puede tener varios efectos en el
comportamiento elitista por parte de los empleadores y la discriminación en el
proceso de contratación:
1. Reducción del Elitismo en Contrataciones:
La política de cuotas asegura que una mayor diversidad de estudiantes, incluyendo
aquellos de orígenes socioeconómicos menos privilegiados y grupos
históricamente marginados (negros, mulatos, indígenas), tengan acceso a
universidades de alta calidad. Esto podría reducir el énfasis de los empleadores en
la procedencia escolar del candidato, ya que el acceso a la educación superior de
calidad sería más equitativo.
2. Discriminación:
Al aumentar la representación de estos grupos en universidades prestigiosas, la
política de cuotas podría ayudar a disminuir la discriminación en el mercado
laboral. Los empleadores tendrían más probabilidades de evaluar a los candidatos
basándose en sus habilidades y logros académicos en lugar de su origen étnico o
socioeconómico.
3. Cambio de Percepción:
Con el tiempo, la política de cuotas podría cambiar la percepción de los
empleadores sobre las capacidades de los estudiantes de grupos marginados,
reconociendo que tienen las mismas oportunidades de acceder a una educación
de calidad y, por ende, pueden ser igualmente competentes.
4. Equidad en Oportunidades:
Esta política promueve una mayor equidad en las oportunidades educativas y
laborales, contribuyendo a una sociedad más inclusiva y justa.
En resumen, la política de cuotas en Brasil puede desempeñar un papel crucial en
la reducción del comportamiento elitista y la discriminación en el proceso de
contratación, promoviendo una evaluación más justa de los candidatos basada en
sus méritos y logros académicos.",100,1,6.7,6.7,6.3,3.5,5.8,5.8,6.1,75.56390977,75.56390977,1,"df1",327,8
31,10,10,10,30,10,"4,5","10",10,10,10,"54,5","84,5","6,6","Hay dos posibilidades ya que no sabemos si en Brasil al igual que en Chile el colegio del que egresó el candidato es una señal relevante:
• Caso 1: si Brasil, al igual que en Chile elige a los candidatos por el colegio del que egresaron entonces el sistema de cuotas
aumentaría aún más la discriminación, ya que además de no haber salido de un colegio de elite, al tener un puntaje para entrar a la universidad más bajo se podría pensar que son menos capaces que los que entraron con el puntaje de corte de libre competencia, disminuyendo así el valor de su señal de educación superior, agravando la discriminación a negros y pueblos indígenas.
• Caso 2: si Brasil a diferencia de Chile no considera el colegio de egreso como una señal importante a la hora de contratar, pero si el lugar de egreso en educación superior, entonces disminuiría la discriminación ya que el sistema de cuotas le da oportunidades a los que tuvieron menos preparación en el colegio o tienen menos oportunidades en otros ámbitos de poder acceder a una educación superior, aportando así la señal de una buena educación superior a la hora de estar en un proceso de contratación.",100,0,7,6.5,6.6,5.3,6.4,5.75,5.9,84.39849624,84.39849624,1,"df1",224,0.5
1,10,10,7,27,10,"8","10",10,10,10,"58","85","6,7","La política de coras de Brasil ayuda a reducir esta segmentación
para contratar, reduce el elitismo y discriminación a negros e indigenas. Esta política aumenta los grupos de representación de negros e indígenas en
la contratación en instituciones, así ellos pueden mostrar su capacidad y cambiar de a poco la perspectiva y prejuicio elitista de los empleadores.",NA,1,7,6.4,6.7,4.5,5.3,6.1,5.6,79.02255639,79.02255639,0,"df1",63,0
121,10,5,10,25,3,"6","7",7,10,10,"43","68","5,5","La implementación de cuotas de equidad en Brasil puede llevar a que las empresas consideren factores más allá de la educación superior. Esto se debe a que personas con mejores puntajes en exámenes, que no fueron admitidas por no entrar en los cupos de equidad, y personas con menores puntajes que sí ingresaron a universidades prestigiosas, generan una percepción de falta de discriminación. Como resultado, las empresas no pueden asegurar la calidad de los trabajadores basándose únicamente en la institución educativa, lo que hace que otros aspectos se vuelven importantes para la selección laboral. La medida de las cuotas podría estar indirectamente impulsando el comportamiento elitista por parte de los empleadores en Brasil. 
Esta señalización ambigua puede resultar en discriminación hacia aquellos que estudiaron en universidades de prestigio pero que son parte de las cuotas de equidad (afrodescendientes, indígenas, entre otros). A pesar de haber estudiado en una buena universidad, los empleadores pueden desconfiar de sus capacidades, pensando que su ingreso pudo deberse a las cuotas de equidad, que requerían menores puntajes. Esto podría agravar la discriminación existente hacia afrodescendientes e indígenas en el mercado laboral, ya que las empresas preferirán no contratarlos para asegurarse de que no hayan sido admitidos por las cuotas de equidad y que efectivamente tengan un buen rendimiento en las pruebas estandarizadas. Las empresas podrían optar a no contratar a personas que cumplan las características de las determinadas etnias de las cuotas, para evitar el riesgo de sub-calificación, al contratar gente que no pueda ser incluida en dichas cuotas se aseguran al 100% que ingresaron de manera competitiva, lo que podría llevar a que no contratan a los afrodescendientes e indígenas, aumentando la discrimancion por “ahorrarse” ese riesgo. Las empresas prefieren estar 100% seguros de que las capacidades de sus trabajadores son las más altas posibles. ",55,0,6.7,6.1,5.5,4.5,5.1,3.7,4.6,65.18796992,65.18796992,1,"df2",420,3
60,10,5,5,20,5,"6","5,5",5,9,9,"39,5","59,5","5,0","En las partes a) y b) de esta pregunta, demostramos que existen diferencias significativas en la nota de corte promedio de los alumnos de amplia competencia y los alumnos con cuota, esta puede ser una razón de porqué suele darse mayor prioridad a los alumnos que estudiaron en escuelas particulares de prestigio.

En mi opinión, la política de cuotas implementada en Brasil tiene dos grandes efectos:
1- Permite el ingreso a la educación superior a grupos generalmente más vulnerables y por lo tanto con menor capacidad económica de asistir a un buen colegio, permitiendo que estas personas construyan un futuro mejor para ellos y sus familias.
2- El hecho de separar a alumnos con cuota y alumnos sin cuota es un acto de discriminación, ya que como pudimos comprobar en la base de datos, se puede saber nombre y apellido de alumno con cuota, por lo tanto si existe un empleador discriminador y racista en contra de los negros y los pueblos indígenas, esto “le facilitaría la tarea”, ya que los candidatos “están marcados” sobre si pertenecen a algunos de estos grupos o no, es decir, si un empleador es racista, es probable que continúe evitando contratar personas negras o indígenas, sin importar sus logros académicos. Por otra parte, se puede dar el caso de que una persona sin cuota obtenga un puntaje alto y, sin embargo, no entre a la universidad ni a la carrera deseada, ya que se le dió su puesto a un alumno con cuota, sin importar si tuvo menor puntaje, en otras palabras, este mecanismo puede llegar a ser “injusto”.

En síntesis, en mi opinión esta política de cuotas no va direccionada a cambiar el comportamiento elitista de un empleador, ya que si es racista no seguirá contratando personas negras o indígenas independiente de sus títulos y logros académicos, si no es capaz de dejar sus preferencias y opiniones de lado por el bien de la empresa implica que el empleador no es racional, es decir, no cambiará su forma de ser sin importar las políticas del país.

Esta política va direccionada a aumentar las posibilidades de desarrollo laboral para grupos generalmente marginados de la sociedad, por lo que el efecto sobre la discriminación de estos grupos es incierto ya que por un lado aumentan sus posibilidades laborales y por lo tanto la posibilidad de escalar en la pirámide social pero
también quedan marcados como miembros de estos grupos, lo cual en lugares donde abunda el racismo y la discriminación es objeto de desprecio.",63,0,6.6,6.3,5,5.5,5.9,6.1,5.9,84.66165414,84.66165414,0,"df1",484,2.5
20,10,7,10,27,4,"5","8",7,10,10,"44","71","5,7","Una empresa, al momento de contratar va a buscar, dentro de sus opciones, al mejor capacitado que logre la mejor productividad para su empresa. En general, a las empresas les conviene que el periodo de contratación sea lo más breve posible, por lo que se debe buscar a una persona que cumpla con los requerimientos de manera rápida y sin perder la ambición por un trabajador productivo y capacitado. La necesidad de las empresas de acelerar el proceso de contratación, fomenta que se creen categorías que permitan clasificar a quienes se postulan al trabajo y así poder elegir y filtrar más rápido. 
Los estudios de los postulantes, hablan de las capacidades y de los aprendizajes que adquirió durante su vida, por lo que es usual que las empresas se interesen de los estudios realizados, debido a que entregan información valiosa con respecto a lo que el individuo va a ser capaz de realizar dentro de su puesto de trabajo. Por esta razón, las empresas suelen preguntar por el historial de estudios, y suelen darle prioridad a quienes obtuvieron mejor educación, ya que si bien son conscientes de que alguien con menor educación podría hacer mejor el trabajo, las probabilidades de que alguien con más educación lo haga mejor son mayores, por lo que con el objetivo de disminuir el tiempo de contratación, prefieren irse por la opción más segura, la cual es priorizar a quienes recibieron una mejor educación y debieran estar más capacitados para cumplir el trabajo con productividad. 
La política de cuotas en las universidades públicas Brasileñas podría terminar por fomentar este tipo de comportamiento elitista por parte de los empleadores en Brasil, debido a que el puntaje de corte es estadísticamente menor al haber estudiado en un colegio público. Por lo que al momento de contratar, para la empresa puede ser mejor visto el haber entrado al curso sin el “beneficio” de tener un puntaje de corte más bajo, clasificando al alumno que ingresa en una competencia amplia mejor que al que entra con el uso de cuotas. Si los puntajes de corte fueran iguales, probablemente las empresas no se fijarían en el colegio, sino en la calidad de educación superior del candidato, lo cual tiene mucho más sentido cuando se busca encontrar a la persona más hábil. Pero cuando la misma universidad hace la distinción entre los que entran con o sin cuotas, hacen una distinción entre “mejores” y “peores” alumnos, y los empleadores ven difícil hacer vista gorda a esta clasificación. 
Si la empresa usa la información de haber entrado con o sin el uso de cuotas al curso en cuestión, negros y provenientes de pueblos indígenas pueden verse afectados habiendo estudiado en un colegio público o no. Un estudiante proveniente de un pueblo indígena, que asistió a un colegio privado, por más de haber obtenido el mismo nivel de educación que un alumno que ingreso sin cuotas, podría verse clasificado de peor manera. Por lo que afecta también a quienes hacen uso de cuotas para entrar a un curso por razones que no tienen que ver con el colegio, siendo clasificados como menos capacitados aun así habiendo asistido al mismo colegio y a la misma universidad. ",0,0,6.5,6.5,5.7,4.1,4.7,6.5,5.4,77.06766917,77.06766917,1,"df1",737,3
251,10,5,10,25,10,"6","7",7,10,10,"50","75","6,0","Si se implementa esta política de cuotas en las universidades públicas brasileras y basándonos en los resultados obtenidos, se puede inferir que este tipo de comportamiento elitista por parte de los empleadores en Brasil disminuiría. Esto debido a que al necesitar una nota promedio menor, se les dará la oportunidad de obtener una educación de calidad. 
La discriminación contra los negros y los pueblos indígenas tendería a disminuir. Esto ya que al lograr una educación superior podrán entrar en el mercado laboral y alcanzar puestos importantes de trabajo. 
Por el contrario, la implementación de esta política podría a su vez, aumentar la discriminación. Esto gracias a que los empleadores al tener las entrevistas de trabajo, si ve que esta persona pertenece a alguna de las cuotas, inmediatamente va a inferir que tiene menos mérito ya que puede haber tenido menos dificultades para entrar.",72,0,6.6,6.8,6,3.7,2.6,5.3,4.4,61.65413534,61.65413534,1,"df2",201,4
