"Unnamed..0","EJ.1.A","EJ.1.B","EJ.1.C","Total.E1","EJ.2.A","EJ.2.B","EJ.2.C","EJ.2D","EJ.2E","EJ.2F","Total.E2","Puntaje.total","HW3_grade","answer_1_c","AI","favorable","HW_1","HW_2","HW_3","Midterm_25","Midterm_25.1","Exam_35","Final_grade","Final_grade_excluding_HW_3","average_grade","had_pair","df_fe","numb_tokes","jaccard_similarity"
27,10,5,10,25,10,"9","10",10,7,8,"54","79","6,3","Viendo que según la b) se les exige menos a los alumnos que ingresan a través de las cuotas, obtener una carrera mediante este sistema puede ser percibido como menos meritorio en comparación con ingresar por la vía regular. Esto puede impactar la discriminación, ya que la señal de la educación superior se debilita al no medir las capacidades de manera uniforme. Como resultado, es probable que exista más discriminación en las entrevistas de trabajo, ya que los empleadores tratarán de ""corregir"" las diferencias de capacidades que el proceso de selección universitario no reflejó adecuadamente. Por lo tanto, aunque las universidades intenten equiparar a ambos grupos mediante diferentes exigencias, en última instancia, las entrevistas laborales podrían intensificar la discriminación. Esto ocurre porque a un grupo se le exigió menos que al otro, y los empleadores buscan capacidades. Es probable que utilicen criterios raciales para ajustar sus evaluaciones. Por ejemplo, si un empleador entrevista a una persona de ascendencia indígena, podría exigirle más que al resto, asumiendo que a esa persona se le pidió menos para ingresar a la misma carrera. Esto sesga la percepción de capacidad, ya que no queda claro si el título fue obtenido por méritos propios o por una exigencia menor.",100,0,6.3,6.3,6.3,4.6,5.8,6,5.6,80.15037594,80.15037594,1,"df1",227,2
30,10,10,7,27,4,"6","8",5,10,10,"43","70","5,7","La implementación de la política de cuotas en las universidades públicas brasileñas podría tener un impacto significativo en la reducción del comportamiento elitista a traves de 2 formas:
1. Diversificación del Acceso a la Educación Superior
2. Cambio de Percepciones y Reducción de la Discriminación
Se le entrega mas oportunidades a estos grupos desfavorecidos, mejorando la competitividad del mercado laboral y aumentando la diversidad en el lugar de trabajo, logrando ademas un cambio en los estereotipos preexistentes. La introduccion de esta politica puede resultar sin duda favorable para reducir la discriminacion contra los negros y pueblos indigenas en el proceso de contratacion, pues lograran estar mejor representados, se reducirán sesgos sobre la calidad y talentos de estos grupos y se crearan precedentes positivos a futuro.",100,1,6.8,7,5.7,5.5,5.7,5.85,5.8,83.27067669,83.27067669,1,"df1",137,5.5
721,10,5,7,22,10,"7","5",6,10,10,"48","70","5,7","La política de cuotas en las universidades públicas brasileñas podría desafiar el elitismo
de los empleadores y reducir la discriminación racial y étnica en las contrataciones. Esto,
ya que, aunque los estudiantes fuera de las cuotas suelen tener un mejor desempeño
académico (como visto en los resultados anteriores), la presencia de graduados de
diversos orígenes en universidades prestigiosas puede cambiar la percepción de los
empleadores, enfocándolos más en habilidades y logros que en antecedentes escolares.
Junto con esto, un aumento de diversidad puede generar el efecto de nivelar para arriba a
todos los alumnos, logrando que los de mejor desempeño motiven a sus compañeros que
son parte de cuotas a aumentar su propio desempeño, de manera que eventualmente
podría hacer que la existencia de cuotas no fuese necesaria y se formara la misma
diversidad de manera normal (debido que todos tendrían un desempeño parecido sin
importar otros factores). Esta política de cuotas también aumenta la representación de
negros e indígenas en el mercado laboral, normalizando la diversidad y ayudando a
desmantelar estigmas, promoviendo así una cultura laboral más inclusiva y equitativa.",41,1,6.7,6.9,5.7,3.7,5,5.2,5,70.30075188,70.30075188,1,"df2",211,3
73,10,4,7,21,3,"5","10",10,10,10,"48","69","5,6","Con las medidas del uso de cuotas en Brasil se podría reducir el elitismo de parte de los empleadores a la hora de contratar trabajadores. Esto se debe a que con esta idea hay más egresados negros y de pueblos indígenas de buenas universidades, de modo que estos tienen así, más oportunidades de ser considerados por los empleadores que con el sistema que hay en Chile. Mientras que, como se dice en el enunciado, Chile tiene múltiples empresas que se interesan por los colegios donde estudiaron los egresados, la medida implementada en Brasil puede mostrar que alumnos que no hayan salido de colegios de alto nivel socio-económico tienen capacidades iguales o superiores a los egresados de dichos colegios.",0,1,6,6.6,5.6,5.2,5.5,4.7,5.2,74.43609023,74.43609023,0,"df2",128,0.5
35,10,5,10,25,8,"3","9",5,10,10,"45","70","5,7","Creo que la política podría afectar el tipo de comportamiento de los empleadores de dos formas posibles:
-Se podría reconocer el mérito de las personas que salieron de escuelas públicas por haber sido capaces de salir de universidades prestigiosas, a pesar de su educación primaria de menor calidad.
-A la vez se podría poner en duda los méritos por el hecho de haber accedido a la universidad a través de una admisión especial con cupos reservados.
Creo que se podría intensificar la discriminación hacia negros e indígenas en el proceso de contratación, se pondrá en duda sus méritos y se les puede mirar con cierto resentimiento por quitarles cupos a personas que tuvieron mejor puntaje en la prueba para acceder a la universidad.
Todo esto por la diferencia que se comprobó significativa en los promedios de puntaje corte entre las personas con y sin cupo.",33,0,6.1,4.3,5.7,3.7,4.6,6,5,70.60150376,70.60150376,0,"df1",158,1.5
661,10,5,7,22,10,"7","0",0,0,0,"17","39","3,6","Al aumentar la representación de estudiantes de diversos orígenes
socioeconómicos y étnicos en instituciones de educación superior de alta calidad,
los empleadores podrían comenzar a valorar más la diversidad como un activo.
Esto podría llevar a una disminución de los prejuicios basados en el tipo de
escuela secundaria que los candidatos han asistido, centrando la atención en la
educación superior obtenida y en los méritos individuales. Además, la mayor
inclusión de negros e indígenas en universidades públicas prestigiosas podría
aumentar su visibilidad en el mercado laboral, ayudando a normalizar la diversidad
racial y étnica en el lugar de trabajo y reduciendo los estereotipos y prejuicios. En
conjunto, estas dinámicas podrían contribuir a un mercado laboral más inclusivo y
equitativo, donde las habilidades y méritos individuales son valorados por encima
del origen socioeconómico y racial.",100,1,6.7,6.7,3.6,5,4.9,4.8,5,72.55639098,72.55639098,1,"df2",155,2.5
210,10,5,7,22,5,"6","10",7,10,10,"48","70","5,7","Cuando los estudiantes con distintos orígenes tienen acceso a la educación superior, los contratadores valoran más las habilidades y competencias adquiridas en la universidad en lugar del origen escolar. Las medidas que toma el gobierno, como las cuotas de acceso a la educación, aumentan la visibilidad y representación de grupos marginados y segregados en la educación y en el trabajo, desafiando estereotipos y prejuicios. Al implementar una política de cuotas, se fomenta una mayor diversidad en las universidades. Esto no solo beneficia a los estudiantes admitidos a través de estas cuotas, sino también a sus compañeros, los cuales se ven expuestos a diferentes perspectivas y experiencias. La interacción diaria con personas de distintos orígenes ayuda a promover una cultura de inclusión y respeto por el que está al lado. Aparte de esto, los egresados de estos grupos discriminados pueden servir como motivación e inspiración para las futuras generaciones, demostrando que el talento no está limitado por el origen étnico o socioeconómico. Con respecto a la discriminación contra los negros y pueblos indígenas, la política de cuotas tiene el potencial de tener un impacto significativo. Históricamente, estos grupos se han subrepresentado en las instituciones de educación superior por barreras económicas y sociales. Al asegurar que un porcentaje de los cupos universitarios esté reservado para estos grupos, se les da una oportunidad más justa para acceder a una educación de calidad y, por ende, a mejores oportunidades laborales. Además, si vemos el efecto en el mercado laboral, las empresas que valoran y practican la inclusión tienden a ser más innovadoras y a tener un ambiente de trabajo más saludable.",100,1,2.9,6.8,5.7,3.5,3.8,3,3.6,50.52631579,50.52631579,1,"df2",293,3.5
39,10,5,10,25,10,"10","10",10,10,10,"60","85","6,7","Creo que la política de cuotas en las universidades públicas brasileñas van a afectar negativamente al comportamiento elitista de los empleadores. Esto debido a que, como pudimos ver tanto en el histograma como en la prueba t, el promedio de las notas de corte de los alumnos de alta competencia es mayor que el promedio de las notas de corte de los alumnos con cuotas. Lo que permite pensar justificadamente, que aquellos alumnos que entraron a la universidad por medio de las políticas de cuotas por poseer determinadas características étnicas, físicas o socioeconómicas, necesitaron un menor rendimiento para aprobar el examen de admisión ""Vestibular"". Y todo ello, incrementará la discriminación a estos grupos específicos pues para adquirir su educación superior necesitaron de un menor puntaje que el resto de jóvenes de la misma generación; Una diferencia de rendimiento bastante significativa según los resultados interpretados en la prueba t de la pregunta b), una diferencia de rendimiento que puede hacer que se menosprecien sus capacidades, y, por lo tanto se subestime su rendimiento futuro en su respectivo empleo.",37,0,6.7,1,6.7,4,NA,5,4.7,65.93984962,65.93984962,1,"df2",194,1.5
12,10,10,7,27,10,"6","10",10,10,10,"56","83","6,5","Basado en los resultados anteriores, tenemos que existe una diferencia notable en la nota de corte entre los alumnos de alta competencia y los alumnos con cuotas, lo cual permite una mayor posibilidad a estos últimos para ingresar a mejores universidades.
• El impacto en el comportamiento elitista por parte de los empleadores:
– La política de cuotas podría impactar reduciendo el comportamiento elitista en el mercado laboral, al dar a los estudiantes de escuelas públicas una mayor oportunidad de acceder a la educación superior. Esto puede cambiar las percepciones y valoraciones de los empleadores sobre los candidatos que provienen de estas instituciones, enfocándose más en sus logros académicos y habilidades profesionales en lugar de su origen escolar.
• El impacto en la discriminación contra negros y de pueblos indígenas en el proceso de contratación:
– Al reservar cupos específicamente para estudiantes negros e indígenas, permite aumentar la presencia de estos grupos en la educación superior. Esto no solo mejora sus oportunidades de empleo, sino que también puede contribuir a cambiar actitudes negativas y reducir prejuicios en el lugar de trabajo, fomentando asi una cultura más inclusiva y diversa.",78,1,6.7,6.7,6.5,3.8,4.9,6.65,5.5,77.78195489,77.78195489,1,"df1",215,6
29,10,5,7,22,5,"6","10",5,10,10,"46","68","5,5","En primer lugar, podemos destacar que a medida que más estudiantes de diferentes antecedentes acceden a las universidades públicas, el prejuicio de que solo los estudiantes de escuelas privadas y de prestigio pueden ofrecer un mejor desempeño puede comenzar a cambiar. Esto puede llevar a que los empleadores valoren más la calidad de la educación superior obtenida, en lugar de enfocarse en la escuela secundaria de origen del candidato. De esta forma, existiría una mayor competencia basada en mérito: Con una mayor diversidad de estudiantes provenientes de diferentes orígenes que acceden a la educación superior de calidad, los empleadores podrían comenzar a valorar más las habilidades y competencias adquiridas en la universidad que el origen escolar. Esto puede reducir el enfoque en la procedencia socioeconómica de los candidatos. 
En cuanto a la discriminación contra los negros y los pueblos indígenas en el proceso de contratación, podemos ver que estas medidas por parte del gobierno brasileño, por ejemplo al aumentar las cotas de acceso a la educación aumenta su visibilidad y representación en el ámbito educativo y, posteriormente, en el mercado laboral. Esta mayor visibilidad puede desafiar y reducir los estereotipos y prejuicios que llevan a la discriminación. 
También a medida que más estudiantes de estos grupos se gradúan y acceden a puestos profesionales, se crean modelos a seguir que pueden inspirar a las generaciones futuras y demostrar que las habilidades y el talento no están limitados por el origen étnico o socioeconómico. 
Y finalmente, destacar una diversidad mayor en el entorno laboral puede fomentar una cultura organizacional más inclusiva, donde se valora la diversidad de pensamiento y experiencia. Esto puede reducir la discriminación y fomentar un ambiente de trabajo más justo y equitativo. ",100,1,6.7,7,5.5,3.7,5.4,4.8,4.9,69.77443609,69.77443609,1,"df1",395,1.5
15,10,5,7,22,3,"5","2",6,10,10,"36","58","4,9","La política de cuotas en las universidades públicas brasileñas puede tener un impacto significativo en cómo los empleadores evalúan a los candidatos y en la discriminación contra grupos marginados en el proceso de contratación. 

Primero, al priorizar el acceso a la educación superior para estudiantes de escuelas públicas y grupos étnicos como negros e indígenas, las cuotas desafían la tendencia actual donde se da preferencia a estudiantes de escuelas particulares prestigiosas en los procesos de contratación. Esto podría cambiar la percepción de los empleadores sobre la relevancia del colegio de origen como señal de capacidad y potencial del candidato.

Además, al enfocarse en los logros académicos y la formación universitaria obtenida a través de cuotas, se puede fomentar una evaluación más objetiva y basada en el mérito. Esto podría reducir la discriminación sistémica al proporcionar oportunidades equitativas para todos los graduados universitarios, independientemente de su trasfondo socioeconómico o étnico.

En términos prácticos, la implementación de cuotas puede promover un cambio cultural hacia un entorno laboral más inclusivo y justo. Al aumentar la diversidad en la educación superior y posteriormente en la fuerza laboral, las políticas de cuotas pueden contribuir a una mayor sensibilidad hacia la equidad y la diversidad en las decisiones de contratación.

En conclusión, las cuotas en las universidades públicas brasileñas tienen el potencial de desafiar el comportamiento elitista en las entrevistas de trabajo y de reducir la discriminación contra grupos históricamente marginados. Al priorizar la educación superior como criterio principal de evaluación, estas políticas pueden promover un mercado laboral más equitativo y meritocrático en Brasil.",100,1,6.9,6.1,4.9,3.4,4.3,5.1,4.6,65.56390977,65.56390977,1,"df2",284,4
311,0,0,0,0,0,"0","0",0,0,0,"0","0","1,0","Si bien la política de cuotas implementada en las universidades públicas brasileñas tiene el objetivo de promover la equidad y proporcionar más oportunidades educativas a grupos históricamente marginados. La política basada en cuotas implementada por Brasil tambien sí podria afectar negativamente la discriminacion contra los negros y Pueblos indigenas en el proceso de contratacion. En primer lugar esto puede actuar como una señalización negativa para los empleados ya que estos podrían asumir y sacar las conclusiones de que ellos no tuvieron que atravesar los mismos estándares académicos que los de amplia competencia para poder ser admitidos.Esto se traduce en una percepción negativa por parte de los empleadores generando perjuicios que su trabajo fue facilitado y no por sus propios méritos concluyendo que estos son menos calificados independientemente de sus habilidades y desempeño real. Por lo tanto al presentarse una persona que pertenezca a uno de estos dos grupos, el contratante inmediatamente generará una discriminacion negativa contra ellos ya que estos obtuvieron privilegio en la educación superior por medio de cuotas aunque este aun así sea un muy buen candidato con muchos estudios de por medio. Esto estaría aumentando aún más la discriminacion a estos grupos fuera de su origen etnico. También podemos ver que si Brasil al igual que Chile también tiene una preferencia por candidatos de colegios particulares con más prestigios fijándose en su procedencia educativa, esta política podría aumentar esta tendencia los empleadores podrían preferir candidatos provenientes de un entorno educativo con mayores oportunidades por lo tanto personas que no tengan la necesidad de acceder a cuotas. Por lo tanto esta política por más que tenga un fin positivo de promover la igualdad sin quererlo puede traer consecuencias negativas aumentando la discriminacion y los comportamientos elitistas en la contratación hacia estos grupos. ",0,0,6.5,6.7,1,3.8,4.4,4.1,4.2,62.33082707,62.33082707,1,"df2",393,0.5
551,10,5,7,22,4,"6","10",10,10,10,"50","72","5,8","La implementación de estas políticas en las universidades brasileñas influyen en gran medida el comportamiento de los empleadores y en la discriminación contra ciertos grupos marginados, esto se debe a las siguientes razones:

- Cambio en la percepción de los empleadores: Al reducir la brecha en la calidad de la educación entre estudiantes de distintos niveles socioeconómicos, los empleadores pueden empezar a valorar más la calidad de la universidad y el rendimiento académico en lugar de el colegio del que salieron. Por otro lado, las políticas de cuotas promueven la diversidad y meritocracia. Los empleadores pueden ver a los graduados con cuotas como estudiantes que superaron varios obstáculos, lo que puede ser una señal positiva.

- Impacto en la discriminación: Al aumentar el número de graduados de estos grupos históricamente marginados, se incrementa su visibilidad en el mercado laboral, lo que permite que los empleadores se familiaricen más con estos grupos. Por otra parte, al garantizar que una proporción de los estudiantes de buenas universidades provengan de entornos diversos, esto ayudará a desmantelar las prácticas elitistas en la contratación, donde el colegio puede haber sido usado como un filtro socioeconómico implícito.",100,1,6.6,6.7,5.8,4.4,6,5.9,5.6,80.15037594,80.15037594,0,"df2",212,4.5
201,10,10,10,30,7,"7","10",10,8,10,"52","82","6,5","Ya que existe un valor-p igual a 0 podemos concluir que existe evidencia estadística significativa para afirmar que la nota de corte promedia es estadísticamente superior para los alumnos de amplia competencia.

De este modo podemos entender que para alumnos de amplia competencia es más difícil acceder a la educación superior frente a los que tienen cuotas reservadas ya que las notas de corte son más altas para ellos. 

Esta estrategia otorga una ventaja de acceso a educación superior para alumnos procedentes de escuelas públicas, alumnos negros y alumnos indígenas. Sin embargo, el comportamiento elitista de los empleadores de discriminar la empleabilidad considerando el colegio en el que estudiaron los postulantes a un trabajo podría representar una amenaza al propósito de la estrategia de cuotas reservadas, ya que el esfuerzo generado en facilitar el acceso a educación superior a estos segmentos de personas sería en vano. Los empleadores categorizarían la calidad del empleado por señales que dictan previas a su educación superior. Es decir, obtener el grado no representaría una señal de alta productividad, alta calificación u otro rasgo de calidad superior.",100,0,7,6.9,6.5,3.2,4.6,4.9,4.7,65.56390977,65.56390977,1,"df2",199,2.5
321,0,0,0,0,0,"0","0",0,0,0,"0","0","1,0","Dado que las notas de corte de los estudiantes afrodescendientes y de pueblos indígenas suelen ser más bajas en comparación con aquellos que ingresan por alta competencia, es probable que la política de cuotas aumente la discriminación hacia los egresados de escuelas públicas y socave la percepción de calidad de la educación superior al disminuir el mérito asociado con el ingreso a una universidad pública. Esta situación podría llevar a los empleadores brasileños a adoptar un comportamiento elitista similar al observado en Chile, aumentando la discriminación contra las personas de color e indígenas protegiéndose así de una posible distorsión en la señal educativa. Inicialmente, la política pública disminuye la brecha social y la desigualdad entre clases socioeconómicas, pero podría aumentar la discriminación laboral. Empeorando la posibilidad de ser contratado para grupos minoritarios.",51,0,6.3,6.8,1,4,4.6,5.9,4.9,73.23308271,73.23308271,1,"df2",140,1.5
18,10,5,10,25,8,"7","10",7,10,9,"51","76","6,1","Analizando los resultados obtenidos anteriormente, los de amplia competencia tienen una nota corte promedio mas alta que los estudiantes de las cuotas, por lo que esto refleja un acceso diferencial a la educación superior entre diferentes grupos socieconomicos y ectnicos, en Brasil. Esto podría afectar el comportamiento de los empleadores hacia uno mas elitista, si medimos la señal de educacion como en el item anterior, va a provocar discriminación de todas formas porque la señal indica que el proceso de selección para los dos tipos de alumnos fue diferente generando que se prefiera uno por sobre otro y no logrando el objetivo con ese mecanismo de selección. Es por esto que podría haber discriminacion racial en el proceso de contratación, al estar la señal sesgada, la selección no es imparcial en terminos de evaluación de candidatos porque saben que las condiciones de selección en primero lugar ya fueron diferentes para ellos, con menor rendimiento, lo cual puede provocar una futura no contratación. ",34,0,6.7,6.9,6.1,3.6,5.4,4.8,4.9,69.32330827,69.32330827,1,"df2",216,0
41,0,3,10,13,4,"5","10",7,10,8,"44","57","4,8","Como se le exige menos para entrar a una universidad a los alumnos que esten en las cuotas, al entrar a una universidad va a tener menos una menor cuota de esfuerzo o merito una persona que este en las cuotas en comparación a otra que no lo este, esto afecta a la señal de discriminación porque la señal de educación superior va a ser peor para medir capacidades por igual, esto va a conllevar a que haya más discriminación en las entrevistas de trabajo para poder contrarrestar estas diferencias de capacidades que el proceso de admisión para la universidad paso por alto. Por lo que aunque la universidad tenga diferentes exigencias para estos grupos, al final las entrevistas de trabajo van a tener que hacer esta discriminación, ya que a un grupo le exigieron menos que al otro. Su forma de discriminar debería ser por las razas, porque si se presenta una persona con descendencia indígena o negro a esta persona se le debería hacer una entrevista más difícil que a una persona que no se le dieron los beneficios para entrar a una universidad, de esta manera estarían viendo si los dos candidatos tienen las mismas cualidades aunque hayan sido exigidos de distinta manera al entrar a la universidad, por lo que aunque se cree este sistema de cuotas de igual manera se hará una discriminación al momento de aplicar para un trabajo.",0,0,6.6,5.1,4.8,3.4,4.3,4.4,4.3,60.90225564,60.90225564,0,"df1",246,0.5
24,10,5,7,22,5,"3","5",7,10,10,"40","62","5,1","Las políticas de cuotas en las universidades públicas brasileñas, cuyo objetivo es aumentar la representación de estudiantes de grupos desfavorecidos como personas de color, de origen indígena o de bajos ingresos, podrían ayudar a mitigar el comportamiento discriminador en el mercado laboral demostrando que los estudiantes de los grupos desfavorecidos mencionados pueden tener un alto rendimiento académico.

Para dar a estos estudiantes acceso a universidades de calidad, las políticas de matrícula podrían reducir la discriminación en el proceso de solicitud, puesto que los empleadores comienzan a prestar más atención a los títulos universitarios que a los orígenes o factores como el colegio donde el postulante estudió, reduciendo así la discriminación basada en circunstancias socioeconómicas y étnicas.

Por lo que esta política tiene el potencial de volver menos elitista el mercado laboral brasileño.",43,1,6.8,6.9,5.1,NA,4.6,5.3,5.3,75.41353383,75.41353383,1,"df1",145,2.5
