"Unnamed..0","EJ.1.A","EJ.1.B","EJ.1.C","Total.E1","EJ.2.A","EJ.2.B","EJ.2.C","EJ.2D","EJ.2E","EJ.2F","Total.E2","Puntaje.total","HW3_grade","answer_1_c","AI","favorable","HW_1","HW_2","HW_3","Midterm_25","Midterm_25.1","Exam_35","Final_grade","Final_grade_excluding_HW_3","average_grade","had_pair","df_fe","numb_tokes","jaccard_similarity"
19,10,7,7,24,5,"4","8",7,10,10,"44","68","5,5","Creo que la política de cuotas podría influir significativamente en la percepción de los
empleadores. Con una diversidad mayor de alumnos en términos de raza y antecedentes educativos, los empleadores podrán valorar más la educación sin hacer distinciones al contratar. Al final, todos habrán recibido la misma educación universitaria, independientemente del colegio de donde provengan, lo que hará que todos sean vistos como bien educados y con capacidades y herramientas similares para desempeñarse en el trabajo. Esto ayudará a reducir el sesgo hacia candidatos de escuelas secundarias prestigiosas.
Además, al aceptar a candidatos más diversos, se fomentará la aparición de una variedad de ideas debido a las diferencias culturales y de pensamiento. Esta diversidad será beneficiosa para las empresas, ya que permitirá enfrentar problemas desde múltiples perspectivas, integrando distintas ideas y encontrando soluciones más innovadoras y efectivas.",100,1,7,6.5,5.5,3.7,5.4,5.85,5.3,75.15037594,75.15037594,1,"df1",153,0
631,10,10,7,27,4,"6","10",6,10,10,"46","73","5,9","La política de cuotas está diseñada para que estudiantes de grupos subrepresentados,
como aquellos de escuelas públicas, comunidades negras e indígenas, puedan acceder a
la educación superior. Esta medida equilibra las oportunidades al ofrecerles una chance
que podrían haber perdido si la competencia se basara solo en notas de corte. 

Al brindar acceso a una educación superior de calidad a un grupo más diverso de
estudiantes, las universidades públicas fomentan la creación de una fuerza laboral más variada. Esto puede llevar a los empleadores a valorar habilidades y competencias por
encima del nombre de la institución educativa del candidato.

Además, cambia las percepciones de prestigio; cuando graduados de distintos orígenes
académicos ingresan al mercado laboral y muestran su capacidad, la idea de que solo los
egresados de colegios prestigiosos pueden tener éxito se debilita. Esto puede disminuir la
dependencia de los empleadores en el historial escolar como principal criterio de
selección.",66,1,6.5,6.5,5.9,4.8,5.8,5.9,5.7,80.67669173,80.67669173,0,"df2",177,2
42,10,10,7,27,2,"8","3",7,10,10,"40","67","5,5","Sabemos que la política de cuotas es para alumnos negros, mulatos, indígenas y
procedentes de escuelas públicas. Así, esto funcionaría como señal al ingresar a la
educación superior. Por lo tanto, la política de cuotas afecta desde esta base, donde no
tenemos un comportamiento elitista a priori, pero si el obtener cuota o no da a entender
que pertenecemos a uno de los grupos antes mencionados (negros, mulatos, indígenas, procedentes de escuelas públicas). 

También podemos decir que, se seguiría manifestando una señal que no se destaca por la educación, pero si las características que conllevan al estudiante a obtener cuotas influyen en lo que la sociedad a instaurado por calidad institucional (públicas < privadas).

Lamentablemente, a raíz de estas situaciones surgen una serie de discriminaciones que son importantes de analizar. El proceso de contratación es importante para conseguir un empleo, se suele usar el curriculum como principal instrumento que muestra las principales ""señales"" del futuro empleado, ya sea experiencia laboral, certificados y educación. Este último punto lo podemos relacionar con la temática principal del ejercicio.

No todas las universidades ofrecen becas, y si las ofrecen o no esto no se presenta en el curriculum, pero si se explicita la institución. Así, el sistema de cuotas puede señalizar al estudiante durante su proceso de educación, pero al enfrentarse al proceso de contratación hay más variables que señalizan nuestras posibles habilidades, y que pueden producir discriminación por parte del contratador.

Además esto puede potenciar a los empleadores a considerar otras habilidades como señalización y debido a los avances en las ayudas de ingreso a la universidad, estas políticas podrían tender a disminuir la discriminación y no solo señalizar desde una universidad de mayor calidad.",0,1,7,7,5.5,4.5,6.1,6.25,5.8,83.27067669,83.27067669,1,"df1",331,0.5
58,10,5,10,25,8,"5","1",5,10,10,"39","64","5,3","La política de cuotas provoca un comportamiento más elitista ya que, ahora la señal que entrega la universidad no es tan ""fiable"". Por los resultados observados los empleadores se concentrarán más en la forma de admisión o en donde se educaron.

Ahora el ser negro o ser perteneciente a un pueblo indígena se asociará a la admisión por cuotas, y como en los resultados se ve que los admitidos por esta vía tienen peor desempeño se les asociará una señal negativa, por la cual podría aumentar la discriminación contra ellos al momento de postular a un empleo.",0,0,6.7,6.5,5.3,4,5.1,5.2,5,71.5037594,71.5037594,0,"df1",107,0
70,10,5,7,22,5,"0","7",10,10,10,"42","64","5,3","La política de cuotas en Brasil tiene implicancias significativas, analizando la base de datos es que se puede concluir la significancia que tiene la política de cuotas en Brasil. Más del 53% de las personas que ingresaron a la universidad el año 2022 se vio afectada por la política de cuotas. Este dato demuestra que la diversificación esta siendo efectiva, por lo que las universidades serán mas representativas de la diversidad de la sociedad y se irán fortaleciendo relaciones entre personas de distintas escuelas y clases socioeconómicas. Dado esta información es que concluyo que si es posible que se vea afectado el comportamiento de los empleadores en Brasil.

Por otro lado esta información también respalda que la discriminación hacia los negros y los pueblos indígenas en el proceso de contratación se verán afectadas. La mayor inclusión de estas personas a la educación superior va a generar que se cambie el prejuicio actual que se tiene sobre ellas. Con el tiempo se generalizará la visión de estas personas como individuos con las mismas capacidades y educación, por lo que se podría concluir que la contratación de una persona negra o indígena no tendría porque estar marcada por ese rasgo, ya que la educación superior que reciben es la misma que la de las personas de una clase socioeconómica mayor. Esta política puede ayudar a que se mejore la reputación intelectual y académica de estos grupos marginados, ya que pueden emerger exitosas personas de estos grupos marginados y el aumento de la diversidad en el mercado laboral será un gran factor que influya en la discriminación hacia ellos.",21,1,5.7,6.2,5.3,4.8,5.2,4.9,5.1,72.33082707,72.33082707,0,"df2",282,3
11,1,1,10,12,4,"6","7",5,10,9,"41","53","4,5","ANALIZANDO EL GRAFICO SE PUEDE INFERIR QUE, AFECTARIA NEGATIVAMENTE EN
LA POLITICA DE CUOTAS CUANTO ESTA ES 0. OSEA CUANDO SE VEA EL NIVEL
SOCIOECONOMICO Y SI ES NEGRO O INDIGENA PARA PODER CREAR UN CONTRATO
PARA CADA TIPO DE ESTUDIANTE NO POR SU CONOCIMIENTO O SI ES DE ALTA
COMPETENCIA, SI NO QUE POR SU ESTATUS SOCIAL, DADO QUE LOS NEGROS E
INDIGENAS EN BRASIL SON MAS CONCURRENTES EN COLEGIOS PUBLICOS O
COLEGIOS QUE NO SON TAN BUENOS, RECAERIA EN ELLOS TODA LA DECISION POR
PARTE DE LOS JEFES YA QUEE LOS EXCLUIRIAN DE SU DECISION DE CONTRATACION.",0,0,5.1,4.9,4.5,2.9,4,5.15,4.3,60.56390977,60.56390977,0,"df1",112,0
65,10,4,7,21,4,"6","10",10,10,10,"50","71","5,7","Las políticas de cuotas en las universidades públicas brasileñas podrían ayudar en lo siguiente:

- La política permite que exista un número mayor de estudiantes de diferentes condiciones socioeconómicas y de diferentes etnias en las universidades públicas de alta calidad. Al haber un número mayor de estudiantes negros e indígenas en universidades públicas de calidad, aumenta el acceso de estos grupos a educación superior de mejor calidad, lo que mejora sus oportunidades de empleo.

- Esta política reduce los prejuicios negativos que algunos empleadores podrían tener. Al ver a personas de estas procedencias en el mercado laboral disminuirán los prejuicios y aumentarán las prácticas inclusivas.

- Se genera un cambio cultural dentro de las empresas, lo que aumenta la inclusión y disminuye la discriminación hacia personas de otras etnias o de otras procedencias económicas.",100,1,6.3,6.9,5.7,4,5.8,6,5.5,78.34586466,78.34586466,0,"df2",149,2.5
241,10,5,10,25,10,"6","10",7,10,10,"53","78","6,2","Basándonos en los resultados anteriores de las preguntas 1. A) y B) en relación a las diferencias promedio en las notas de corte y teniendo en cuenta que la nota de corte promedio es superior para los alumnos de amplia competencia, en comparación con los alumnos beneficiarios de una cuota. Esto implica que los alumnos de amplia competencia, generalmente, requieren puntajes mas altos para ser admitidos en los mismos cursos que los alumnos beneficiados. Por otra parte, la política de cuotas implementada en Brasil asegura que el 50% de los cupos de admisión en los cursos, están asegurados/reservados, para alumnos que provienen de escuelas públicas y dentro de este 50%, hay fracciones específicas para alumnos negros, mulatos, indígenas, etc. Es por este sistema, que podemos observar ciertas implicancias, que serán abordadas a continuación:

1. En relación al comportamiento elitista de los empleadores:
Si es que los estudiantes beneficiados de cuotas, demuestran que logran un buen desempeño, esto puede producir, que cambien los prejuicios y disminuya un poco el comportamiento elitista por parte de los empleadores, ya que, esto podría demostrar que las capacidades no dependen
únicamente del colegio al cual asistió el alumno y de esta manera se podrían empezar a valorar más los resultados académicos universitarios. Con este sistema de cuotas, como pueden ingresar mas alumnos beneficiados a las universidades, estas pueden presentar una mayor diversidad de alumnos, y gracias a esto generar enseñanzas distintas a cuando no estaba este sistema, es por esto, que se podría reducir el sesgo que realizan los empleadores en relación con los alumnos asistentes a colegios privados y más caros, debido a que se puede tomar más en cuenta las habilidades y capacidades adquiridas en la educación superior.

2. Efecto en la discriminación contra los negros y los pueblos indígenas en los procesos de contratación:
Como el sistema de cuotas le otorga más oportunidades de acceder a una educación superior de calidad, en el caso de los negros e indígenas, estos van a estar más nivelados con el resto de las personas a la hora de entrar al mercado laboral. Todo esto, debido a que pueden tener títulos de universidades más prestigiosas, que antes era más difícil de obtener, lo que puede hacer que haya menores barreras de discriminación en relación a este entorno. Al incluir aún más a los negros e indígenas en las universidades de calidad, pueden eventualmente producir una mayor inclusión de ellos en el mercado laboral, reduciendo la discriminación en relación a los empleos. Esto, debido a que al tener mayor contacto y visibilidad con ellos, se pueden ir reduciendo ciertos estereotipos. Además, con el sistema de cuotas se promueve la inclusión en la educación, por lo que, puede llevar a que también se promueva más en el mercado laboral y los empleadores valoren más la diversidad. Hay que tener en cuenta, que para ambas preguntas también podría suceder el caso contrario, en el caso del impacto en el comportamiento elitista de los empleadores, podría suceder, que aumente la tendencia de considerar los colegios en los procesos de contratación, debido a que como las cuotas aseguran que estudiantes de diversas procedencias tienen acceso a este nivel alto de universidades, recurren a los colegios como método de diferenciación para evaluar a los candidatos. En relación al impacto en la discriminación, si es que los empleadores continúan analizando el colegio de procedencia para la selección, las barreras de discriminación se podrían mantener, enfrentando desventajas en el mercado laboral y reduciendo las posibilidades de empleo.",0,0,6.6,6.7,6.2,3.6,5.8,5.6,5.3,74.81203008,74.81203008,1,"df2",658,2
51,10,10,7,27,6,"6","10",5,10,3,"40","67","5,5","Basado en los resultados obtenidos, es posible que la política de cuotas en las universidades brasileñas tengan un impacto positivo en la reducción del comportamiento elitista por parte de los empleadores. Al garantizar que un mayor número de estudiantes de diversas etnias y procedencias socioeconómicas acceden a una educación superior de calidad, se espera que los empleadores vean un grupo más diverso de candidatos graduados de estas instituciones prestigiosas. Esto podría ayudar a disminuir la discriminación basada en la escuela de procedencia y aumentar la valoración de las competencias y habilidades durante la educación superior. Además, al permitir que más estudiantes negros e indígenas accedan a la educación superior, la política de cuotas puede ayudar a reducir la discriminación contra estos grupos en el proceso de contratación. Con mayor representación en las universidades públicas de alto nivel, estos grupos podrían enfrentar menos prejuicios y ser elevados más equitativamente por sus méritos académicos y profesionales.",100,1,6.7,6.4,5.5,3.3,5.5,4.1,4.6,64.5112782,64.5112782,1,"df2",164,6.5
9,10,5,7,22,4,"7","10",7,10,10,"48","70","5,7","La política de cuotas en las universidades públicas podría afectar en varios puntos el tipo de comportamiento elitista por parte de los empleadores en Brasil.

En primer lugar, tenemos que esta política podría reducir el comportamiento elitista. Esto se debe a que las cuotas pueden nivelar el campo, equilibrando la educación superior. Al entregar más parejos, el conjunto de estudiantes va a estar más diversificado, representando de mejor manera la sociedad en la que vivimos.

En segundo lugar, la política de cuotas va a reducir la discriminación en contra de los negros y pueblos indígenas. Esto va a permitir que estos estudiantes tenga una mayor representación y van a disminuir las barreras culturales. Ambas cosas van a permitir mayores oportunidades en el mercado laboral.

Por lo tanto, la política de cuotas podría tener un gran efecto positivo en la reducción del comportamiento elitista y en la reducción en la discriminación en contra de los negros y de los pueblos indígenas en el proceso de contratación.",100,1,6.9,6.9,5.7,3.6,NA,4.8,4.8,67.21804511,67.21804511,0,"df1",185,6
7,10,5,7,22,4,"4","7",5,10,10,"40","62","5,1","A mi juicio, la política de cuotas en las universidades públicas brasileñas podría
reducir el comportamiento elitista de los empleadores al diversificar la composición
de la gente que egresa de la universidad. Pues, al permitir que estudiantes de diversos
orígenes socioeconómicos accedan a la educación superior, podrían aumentar
enormemente sus posibilidades de entrar al mercado laboral. Además, con graduados
de diferentes orígenes demostrando una alta capacidad para realizar su profesión, los
empleadores podrían verse impulsados a valorar las habilidades y el desempeño por
encima del prestigio institucional o el estatus social, disminuyendo así la preferencia
por candidatos que provengan de ambientes elitistas.

La política de cuotas podría disminuir la discriminación contra negros e indígenas en
el proceso de contratación al aumentar su representación en la educación superior y,
consecuentemente, en el mercado laboral. Al acceder a universidades de calidad, estos
grupos de la sociedad podrían demostrar sus capacidades y competir en igualdad de
condiciones con todos los demás, desafiando así los estereotipos negativos y
prejuicios existentes hacia ellos. Además, podría contribuir a sensibilizar a los
empleadores sobre la importancia de la diversidad, promoviendo así prácticas de
contratación más inclusivas y equitativas, que valoren las competencias de los
individuos y no solamente los antecedentes étnicos o raciales. Ser negro o provenir
de un pueblo indígena, no significa que estén incapacitados para trabajar o cumplir
bien sus labores.",100,1,6.3,6.7,5.1,3.5,5.9,5.25,5.1,72.7443609,72.7443609,1,"df1",267,5.5
561,10,10,7,27,4,"5","10",10,10,10,"49","76","6,1","Si Brasil implementa la política de cuotas, podría significar un gran cambio en la
contratación, ya que daría prioridad a los candidatos con una sólida formación educativa sobre aquellos con calificaciones avanzadas. Esto ayuda a nivelar el campo de juego para aquellos que tradicionalmente no han tenido acceso a educación de élite, permitiendo que el talento y la capacidad sean los verdaderos criterios de selección.

La inclusión de grupos desfavorecidos en las universidades y el mercado laboral puede desafiar y, en última instancia, reducir los estereotipos raciales y socioeconómicos. La diversidad en el lugar de trabajo muestra que la eficacia profesional no se ve influenciada por la raza o el nivel socioeconómico, por lo que la lucha contra la discriminación depende en gran medida de esto. 

Las cuotas no solo promueven la igualdad de oportunidades en la educación superior, sino que también pueden transformar los principios de equidad en el mercado laboral, dando como resultado prácticas de contratación más justas que prioricen el mérito sobre el lugar del fondo socioeconómico o racial de los candidatos.",37,1,6.4,7,6.1,5.1,5.5,5.1,5.4,76.76691729,76.76691729,1,"df2",193,3.5
81,10,5,10,25,4,"5","10",7,10,10,"46","71","5,7","La política de cuotas en las universidades públicas de Brasil intenta ser justa y dar más oportunidades educativas a grupos que han sido marginados por mucho tiempo. Sin embargo, esta política puede tener efectos mixtos en cómo los empleadores ven a estos estudiantes y en la discriminación contra las personas negras e indígenas durante el proceso de contratación.

Los empleadores podrían pensar que los estudiantes que entraron por cuotas no tuvieron que cumplir con los mismos estándares académicos difíciles que los demás, lo que podría ser visto de manera negativa. Esto puede actuar como una señalización negativa, ya que los empleadores podrían asumir que estos candidatos no atravesaron los mismos estándares académicos que la competencia para poder ser admitidos. Este prejuicio podría llevar a la conclusión de que estos estudiantes son menos calificados, sin importar sus habilidades y desempeño real.

Si los empleadores creen que los estudiantes de cuotas recibieron ventajas en su educación superior, podrían discriminar contra ellos, incluso si son buenos candidatos con muchas calificaciones. El contratante, al presentarse una persona que pertenece a uno de estos grupos, podría generar una discriminación negativa, concluyendo que su educación fue facilitada y no por sus propios méritos. Esto estaría aumentando aún más la discriminación a estos grupos fuera de su origen étnico.

La preferencia por candidatos de escuelas privadas y prestigiosas podría crecer, ya que los empleadores podrían pensar que los estudiantes de cuotas recibieron una educación de menor calidad. Esto podría llevar a una mayor discriminación y actitudes elitistas en la contratación hacia estos grupos, a pesar del objetivo positivo de la política de promover la igualdad. Los empleadores podrían preferir candidatos provenientes de un entorno educativo con mayores oportunidades, personas que no tuvieron la necesidad de acceder a cuotas.",64,0,6.2,6.5,5.7,3.9,5.8,4.9,5.1,71.80451128,71.80451128,1,"df2",320,2
111,10,10,10,30,0,"1","1",6,10,10,"28","58","4,9","Brasil, con el mecanismo de cuotas, puede ser un tipo de señalización para los empleadores. Al ver un alumno con esta condición puede que piense que al entrar a una carrera requiriendo un menor puntaje, este sea menos productivo o menos competitivo, reafirmando un comportamiento elitista y perjudicando a las personas negras y de pueblos indígenas al ser discriminados por cumplir esta condición de cuotas y ser vistos como menos capaces.",NA,0,5.6,6.8,4.9,3.8,4.9,5.7,5,72.03007519,72.03007519,1,"df2",77,0
271,10,10,7,27,4,"7","9",5,10,9,"44","71","5,7","La política de cuotas se implementa para facilitar el acceso a la educación superior a estudiantes de grupos que han sido históricamente subrepresentados, como aquellos provenientes de escuelas públicas y comunidades afrodescendientes e indígenas. Esta medida busca nivelar las oportunidades, permitiendo que estudiantes que podrían ser excluidos en un sistema basado únicamente en notas de corte tengan acceso a la educación superior. 

Al permitir que una variedad más diversa de estudiantes acceda a una educación de calidad, las universidades públicas ayudan a crear una fuerza laboral más heterogénea. Esto puede llevar a los empleadores a valorar habilidades y competencias que van más allá del rendimiento académico tradicional. 

Además, esta política puede cambiar la percepción del prestigio académico. A medida que los graduados de distintos orígenes académicos se integran al mercado laboral y demuestran sus capacidades, la idea de que solo los estudiantes de colegios prestigiosos pueden tener éxito se debilita. Así, los empleadores podrían depender menos del historial académico como el principal criterio de selección. ",100,1,6.7,6.7,5.7,2.7,4.8,4.7,4.5,63.0075188,63.0075188,0,"df2",261,2
28,10,5,10,25,8,"5","10",5,8,10,"46","71","5,7","La política de cuotas en las universidades públicas de Brasil podría afectar este tipo de comportamiento elitista, de forma que ahora quienes ocupen estos puestos van a tener la misma señalización que sus compañeras de carreara en cuanto a sus estudios superiores lo que lleva a los empleadores a reconsiderar su sesgo ya que con las cuotas, se entregan oportunidades a personas negras e indígenas por lo que de a poco irá desapareciendo el sesgo que personas de ese origen no reciben la misma educación de calidad que otros. Esto podría afectar a los negros e indígenas de forma que le dan mayores oportunidades. Hay que tener en cuanto a las cuotas que son solo una herramienta, por lo que no es la única solución y de ser mal aplicado podría tener un efecto contrario donde en vez de ayudar, aporte de forma negativa al ámbito de discriminación y elitismo.",0,1,6.6,6.1,5.7,3.8,4.8,5.15,4.9,68.98496241,68.98496241,1,"df1",157,2
131,10,5,10,25,4,"8","7",7,10,10,"46","71","5,7","Dado que el sistema además de admitir a los alumnos por sus puntajes los elige por otras
características, ser o no negro, ser o no de pueblos indígenas, se puede generar un nivel de
discriminación debido a que como hay cierto porcentaje de alumnos que deben pertenecer a
estas características, dejan de elegir a ciertas personas que quizá obtuvieron mejores puntajes
pero que fueron rechazados debido a que los cupos los debía utilizar otro alumno precedente
del sistema de cotas. Por otro lado, esta política de cuotas es una medida diseñada para
promover la equidad y la diversidad en la educación superior. Al garantizar el acceso a
universidades de alta calidad para estudiantes de grupos desfavorecidos, esta política no solo
mejora sus oportunidades educativas y laborales, sino que también contribuye a reducir el
elitismo y la discriminación en el mercado laboral. La teoría de la señalización apoya la idea de
que, al mejorar la diversidad de estudiantes en universidades prestigiosas, se mejora la
percepción de capacidad y talento de una gama más amplia de individuos, beneficiando tanto
a los estudiantes como a la sociedad en general.",57,0,6.4,6.3,5.7,5.2,4.9,4.4,5,70.67669173,70.67669173,1,"df2",212,3.5
33,10,5,7,22,7,"6","10",10,10,10,"53","75","6,0","El comportamiento elitista por parte de los empleadores en Brasil, se puede ver afectado por la política de cuotas implementada por las universidades, ya que la educación superior de calidad deja de ser un privilegio. Ahora gran parte de la población brasileña puede acceder an ella independiente de si pertenecen a minorías. Esto permite disminuir el comportamiento elitista, porque el colegio del cual salieron los postulantes ya no es una señal válida para medir las capacidades de las personas, es decir, salir de un colegio público no es motivo para ser rechazado en un trabajo como ocurría antes. La política de cuotas permite que los empleadores al momento de contratar se encuentren con un grupo mas diverso de personas pero con la característica de que todos cuentan con el mismo nivel de conocimiento y habilidades, por ende ya no hay espacio para discriminar. 
Con respecto al efecto que tiene la política en la discriminación que se produce contra los negros y los pueblos indígenas en el proceso de contratación, esta debiese disminuir porque ahora estos grupos tienen mayores posibilidades para estudiar en universidades públicas de calidad. Esto genera que las personas pertenecientes a las minorías afectadas, tengan mayores oportunidades laborales, pues antes de la implementación de la política de cuotas se les daba mayor prioridad a las personas que habían salido de colegios privados y de prestigio, por ende no era posible que una persona negra o indígena llegar a obtener un cargo en una empresa, pero sabemos que con la implementación de la política este escenario cambio, porque sus oportunidades laborales se extendieron.",37,1,6.9,6.7,6,3.8,5.5,5.5,5.2,74.13533835,74.13533835,1,"df2",352,3
